service,speaker,utterance,state,HR_message,Employee_message,entities
safety_incident_report,"[0, 1, 0, 1, 0, 1, 0, 1, 0, 1, 0, 1, 0, 1, 0, 1]","['HR Assistant: Okay, no problem. How did things turn out for you? Were you the only one affected?', 'Employee: Yes, it was just me involved in the incident.  ', 'HR Assistant: I see. Was anyone around to see what happened?', ""Employee: No, there weren't any witnesses to the incident."", ""HR Assistant: Ouch, that's no good. Did you end up getting hurt at all? What happened there?"", 'Employee: I sprained my ankle.', 'HR Assistant: Yikes, sorry to hear that. On a scale of minor to severe, how bad was the incident? Also, do you remember what time it took place?', 'Employee: The incident was moderate and it occurred at 2:30 PM.', 'HR Assistant: Got it. Is there anything else you think I should know about what happened? Any other details or thoughts you have?', 'Employee: I was working in Studio B and I think we need better safety measures in place in the studio.  ', 'HR Assistant: Okay, thanks for letting me know. Can you also provide your contact info like your name, email and phone number so I have that on file?', 'Employee: My name is Elijah Barnes, my email is elijahmusic@gmail.com.', 'HR Assistant: Did any equipment get broken during the incident?', 'Employee: No, there was no property damage.', 'HR Assistant: Alright, last couple questions - what immediate steps did you take after the incident occurred? And do you remember what date it happened?', 'Employee: I administered first aid at the scene. The date was February 15, 2023.']","[{'affected_individuals': 'Yes, it was just me', 'incident_type': 'Yes, it was just me involved in the incident'}, {'witnesses': 'No'}, {'injuries_sustained': 'sprained my ankle'}, {'severity_of_incident': 'moderate', 'incident_time': '2:30 PM'}, {'additional_notes': 'I think we need better safety measures in place in the studio'}, {'incident_location': 'elijahmusic@gmail.com', 'reporter_contact_info': 'Elijah Barnes'}, {'property_damage': 'No'}, {'immediate_actions_taken': 'first aid', 'incident_date': 'February 15, 2023'}]","['Okay, no problem. How did things turn out for you? Were you the only one affected?', 'I see. Was anyone around to see what happened?', ""Ouch, that's no good. Did you end up getting hurt at all? What happened there?"", 'Yikes, sorry to hear that. On a scale of minor to severe, how bad was the incident? Also, do you remember what time it took place?', 'Got it. Is there anything else you think I should know about what happened? Any other details or thoughts you have?', 'Okay, thanks for letting me know. Can you also provide your contact info like your name, email and phone number so I have that on file?', 'Did any equipment get broken during the incident?', 'Alright, last couple questions - what immediate steps did you take after the incident occurred? And do you remember what date it happened?']","['Yes, it was just me involved in the incident.', ""No, there weren't any witnesses to the incident."", 'I sprained my ankle.', 'The incident was moderate and it occurred at 2:30 PM.', 'I was working in Studio B and I think we need better safety measures in place in the studio.', 'My name is Elijah Barnes, my email is elijahmusic@gmail.com.', 'No, there was no property damage.', 'I administered first aid at the scene. The date was February 15, 2023.']","{'affected_individuals': 'Yes, it was just me', 'incident_type': 'Yes, it was just me involved in the incident', 'witnesses': 'No', 'injuries_sustained': 'sprained my ankle', 'severity_of_incident': 'moderate', 'incident_time': '2:30 PM', 'additional_notes': 'I think we need better safety measures in place in the studio', 'incident_location': 'elijahmusic@gmail.com', 'reporter_contact_info': 'Elijah Barnes', 'property_damage': 'No', 'immediate_actions_taken': 'first aid', 'incident_date': 'February 15, 2023'}"
safety_incident_report,"[0, 1, 0, 1, 0, 1, 0, 1, 0, 1, 0, 1, 0, 1, 0, 1, 0, 1]","['HR Assistant: No problem, let me know what happened. Was it a minor issue or something more serious? (e.g., Minor, Moderate, Severe)  ', 'Employee: It was a moderate incident.', ""HR Assistant: Ouch, I'm sorry to hear that. Was anything damaged in the incident? If so, can you tell me what happened? What time did this all go down?"", 'Employee: There was no property damage, the incident occurred at 10:00 AM.  ', 'HR Assistant: Got it. Where exactly did this incident take place?', 'Employee: The incident took place in the office.', 'HR Assistant: Okay, what did you do right after it happened?', 'Employee: First aid was administered.  ', 'HR Assistant: When did this all go down exactly? You can just give me the date.', 'Employee: The date was February 15, 2023.', 'HR Assistant: Were you hurt at all? If so, can you tell me about your injuries?', 'Employee: I sprained my ankle.', ""HR Assistant: Thanks for letting me know. Can you tell me what type of safety incident you're reporting, like a workplace injury? Did anyone see what happened?"", 'Employee: It was a workplace injury, John Doe witnessed it.', 'HR Assistant: Just a few more questions - anything else I should know? And can you give me your contact info so I have it on file?', 'Employee: We may need better floor mats. My name is Sofia Alvarez, my email is salvarez@lawfirm.com and my phone number is XXX-XXX-XXXX.  ', 'HR Assistant: Last question - how many people were involved in the incident?', 'Employee: One person was affected by the incident.']","[{'severity_of_incident': 'moderate'}, {'property_damage': 'no', 'incident_time': '10:00 AM'}, {'incident_location': 'in the office'}, {'immediate_actions_taken': 'First aid'}, {'incident_date': 'February 15, 2023'}, {'injuries_sustained': 'sprained my ankle'}, {'incident_type': 'workplace injury', 'witnesses': 'John Doe witnessed it'}, {'additional_notes': 'We may need better floor mats', 'reporter_contact_info': 'XXX-XXX-XXXX'}, {'affected_individuals': 'One'}]","['No problem, let me know what happened. Was it a minor issue or something more serious? (e.g., Minor, Moderate, Severe)', ""Ouch, I'm sorry to hear that. Was anything damaged in the incident? If so, can you tell me what happened? What time did this all go down?"", 'Got it. Where exactly did this incident take place?', 'Okay, what did you do right after it happened?', 'When did this all go down exactly? You can just give me the date.', 'Were you hurt at all? If so, can you tell me about your injuries?', ""Thanks for letting me know. Can you tell me what type of safety incident you're reporting, like a workplace injury? Did anyone see what happened?"", 'Just a few more questions - anything else I should know? And can you give me your contact info so I have it on file?', 'Last question - how many people were involved in the incident?']","['It was a moderate incident.', 'There was no property damage, the incident occurred at 10:00 AM.', 'The incident took place in the office.', 'First aid was administered.', 'The date was February 15, 2023.', 'I sprained my ankle.', 'It was a workplace injury, John Doe witnessed it.', 'We may need better floor mats. My name is Sofia Alvarez, my email is salvarez@lawfirm.com and my phone number is XXX-XXX-XXXX.', 'One person was affected by the incident.']","{'severity_of_incident': 'moderate', 'property_damage': 'no', 'incident_time': '10:00 AM', 'incident_location': 'in the office', 'immediate_actions_taken': 'First aid', 'incident_date': 'February 15, 2023', 'injuries_sustained': 'sprained my ankle', 'incident_type': 'workplace injury', 'witnesses': 'John Doe witnessed it', 'additional_notes': 'We may need better floor mats', 'reporter_contact_info': 'XXX-XXX-XXXX', 'affected_individuals': 'One'}"
safety_incident_report,"[0, 1, 0, 1, 0, 1, 0, 1, 0, 1, 0, 1, 0, 1, 0, 1]","['HR Assistant: No problem, let me get some details to help report it. What happened to cause the incident? Was it an injury, fire or hazardous spill?  ', 'Employee: It was a workplace injury.', 'HR Assistant: Okay, thanks for letting me know. Were you the only one affected or were others involved too?', 'Employee: Just me. ', 'HR Assistant: No problem. Do you have any other details you think would be helpful for me to know? And can I get your contact info in case I need to follow up?', 'Employee: No other details. My name is Sofia Alvarez and I can be reached at salvarez@lawfirm.com.', 'HR Assistant: Thanks Sofia. Were there any witnesses to what happened?', 'Employee: No, I was alone at the time.', 'HR Assistant: Got it. On a scale of minor to severe, how would you rate the incident? And do you remember what day it took place?', 'Employee: It was moderate and it occurred on February 15, 2023.  ', 'HR Assistant: No problem. Do you recall around what time of day it happened?', 'Employee: It was at 10:00 AM.', 'HR Assistant: Almost done. Was any property damaged? And can you tell me where the incident took place?', 'Employee: No property was damaged. It occurred in my office.', 'HR Assistant: Thank you for all the details. Lastly, what first aid or immediate care did you receive after? And do you mind sharing if you sustained any injuries?', 'Employee: First aid was administered. I sprained my ankle.']","[{'incident_type': 'workplace injury'}, {'affected_individuals': 'Just me'}, {'additional_notes': 'No other details', 'reporter_contact_info': 'salvarez@lawfirm.com'}, {'witnesses': 'No, I was alone'}, {'severity_of_incident': 'moderate', 'incident_date': 'February 15, 2023'}, {'incident_time': '10:00 AM'}, {'property_damage': 'It occurred in my office', 'incident_location': 'in my office'}, {'immediate_actions_taken': 'First aid', 'injuries_sustained': 'sprained my ankle'}]","['No problem, let me get some details to help report it. What happened to cause the incident? Was it an injury, fire or hazardous spill?', 'Okay, thanks for letting me know. Were you the only one affected or were others involved too?', 'No problem. Do you have any other details you think would be helpful for me to know? And can I get your contact info in case I need to follow up?', 'Thanks Sofia. Were there any witnesses to what happened?', 'Got it. On a scale of minor to severe, how would you rate the incident? And do you remember what day it took place?', 'No problem. Do you recall around what time of day it happened?', 'Almost done. Was any property damaged? And can you tell me where the incident took place?', 'Thank you for all the details. Lastly, what first aid or immediate care did you receive after? And do you mind sharing if you sustained any injuries?']","['It was a workplace injury.', 'Just me.', 'No other details. My name is Sofia Alvarez and I can be reached at salvarez@lawfirm.com.', 'No, I was alone at the time.', 'It was moderate and it occurred on February 15, 2023.', 'It was at 10:00 AM.', 'No property was damaged. It occurred in my office.', 'First aid was administered. I sprained my ankle.']","{'incident_type': 'workplace injury', 'affected_individuals': 'Just me', 'additional_notes': 'No other details', 'reporter_contact_info': 'salvarez@lawfirm.com', 'witnesses': 'No, I was alone', 'severity_of_incident': 'moderate', 'incident_date': 'February 15, 2023', 'incident_time': '10:00 AM', 'property_damage': 'It occurred in my office', 'incident_location': 'in my office', 'immediate_actions_taken': 'First aid', 'injuries_sustained': 'sprained my ankle'}"
safety_incident_report,"[0, 1, 0, 1, 0, 1, 0, 1, 0, 1, 0, 1, 0, 1, 0, 1, 0, 1]","['HR Assistant: No problem, let me know if you have any other details you want to include or if there was any property damage. Was everything else okay?', ""Employee: No, there weren't any additional notes and nothing was damaged.  "", 'HR Assistant: Okay, thanks for letting me know. On a scale of minor to severe, how would you rate the incident?  ', ""Employee: I'd say it was moderate."", ""HR Assistant: I'm sorry to hear that. Were you hurt at all? Please share what happened if you feel comfortable."", 'Employee: I sprained my ankle.', 'HR Assistant: I understand. Was anyone around who saw what took place?', 'Employee: No, I was alone at the time.', ""HR Assistant: What did you do after it occurred? I'm sure you wanted to take care of yourself first."", 'Employee: I administered first aid.', 'HR Assistant: When did this all happen? Also, was it just you or were others impacted too?', 'Employee: It occurred at 10:00 AM and only I was affected.', ""HR Assistant: Could you please tell me what type of incident you're reporting, like a workplace injury? I just want to be clear on details.  "", 'Employee: It was a workplace injury.', 'HR Assistant: Last couple questions - where did it take place and when? I need those details for the report.', 'Employee: It was in the office and the date was February 15, 2023.', 'HR Assistant: Great, thank you for sharing all that. Can I please get your contact info like your name, email and phone number to attach to the report?', 'Employee: My name is Sofia Alvarez, email is salvarez@lawfirm.com']","[{'additional_notes': ""No, there weren't any additional notes"", 'property_damage': 'nothing'}, {'severity_of_incident': 'moderate'}, {'injuries_sustained': 'sprained my ankle'}, {'witnesses': 'No, I was alone'}, {'immediate_actions_taken': 'first aid'}, {'incident_time': '10:00 AM', 'affected_individuals': 'only I was affected'}, {'incident_type': 'workplace injury'}, {'incident_location': 'in the office', 'incident_date': 'February 15, 2023'}, {'reporter_contact_info': 'Sofia Alvarez'}]","['No problem, let me know if you have any other details you want to include or if there was any property damage. Was everything else okay?', 'Okay, thanks for letting me know. On a scale of minor to severe, how would you rate the incident?', ""I'm sorry to hear that. Were you hurt at all? Please share what happened if you feel comfortable."", 'I understand. Was anyone around who saw what took place?', ""What did you do after it occurred? I'm sure you wanted to take care of yourself first."", 'When did this all happen? Also, was it just you or were others impacted too?', ""Could you please tell me what type of incident you're reporting, like a workplace injury? I just want to be clear on details."", 'Last couple questions - where did it take place and when? I need those details for the report.', 'Great, thank you for sharing all that. Can I please get your contact info like your name, email and phone number to attach to the report?']","[""No, there weren't any additional notes and nothing was damaged."", ""I'd say it was moderate."", 'I sprained my ankle.', 'No, I was alone at the time.', 'I administered first aid.', 'It occurred at 10:00 AM and only I was affected.', 'It was a workplace injury.', 'It was in the office and the date was February 15, 2023.', 'My name is Sofia Alvarez, email is salvarez@lawfirm.com']","{'additional_notes': ""No, there weren't any additional notes"", 'property_damage': 'nothing', 'severity_of_incident': 'moderate', 'injuries_sustained': 'sprained my ankle', 'witnesses': 'No, I was alone', 'immediate_actions_taken': 'first aid', 'incident_time': '10:00 AM', 'affected_individuals': 'only I was affected', 'incident_type': 'workplace injury', 'incident_location': 'in the office', 'incident_date': 'February 15, 2023', 'reporter_contact_info': 'Sofia Alvarez'}"
safety_incident_report,"[0, 1, 0, 1, 0, 1, 0, 1, 0, 1, 0, 1, 0, 1, 0, 1, 0, 1, 0, 1]","[""HR Assistant: Oh no, I'm sorry to hear that. What immediate steps did you take after the incident occurred?"", 'Employee: I provided myself with some first aid. ', 'HR Assistant: Were there any other notes or observations you wanted to include?', 'Employee: We could really use some better floor mats in here.', 'HR Assistant: How many people were impacted by what happened?', 'Employee: Just one person was affected, me.', 'HR Assistant: Could you please provide your contact details and when it took place?', 'Employee: My name is Dr. Li Wei, my email is liwei@medicalemail.com, and this happened on February 15th, 2023.  ', 'HR Assistant: Do you mind telling me where it occurred?', 'Employee: It happened in one of the hospital rooms.', 'HR Assistant: What type of incident are you reporting, like a workplace injury or something else?', ""Employee: I'm reporting a workplace injury."", 'HR Assistant: Was any property damaged? If so, could you describe it?', 'Employee: No property was damaged.', 'HR Assistant: Were there any witnesses around?', 'Employee: There were no witnesses.', 'HR Assistant: Could you also provide the time and any injuries?', 'Employee: It happened at 2:30pm. I sustained a sprained ankle.', 'HR Assistant: On a scale of minor to severe, how would you classify the incident?', ""Employee: I'd say it was a moderate incident.""]","[{'immediate_actions_taken': 'provided myself with some first aid'}, {'additional_notes': 'We could really use some better floor mats in here'}, {'affected_individuals': 'one'}, {'reporter_contact_info': 'Dr. Li Wei', 'incident_date': 'February 15th, 2023'}, {'incident_location': 'in one of the hospital rooms'}, {'incident_type': 'workplace injury'}, {'property_damage': 'No'}, {'witnesses': 'no'}, {'incident_time': '2:30pm', 'injuries_sustained': 'a sprained ankle'}, {'severity_of_incident': 'moderate'}]","[""Oh no, I'm sorry to hear that. What immediate steps did you take after the incident occurred?"", 'Were there any other notes or observations you wanted to include?', 'How many people were impacted by what happened?', 'Could you please provide your contact details and when it took place?', 'Do you mind telling me where it occurred?', 'What type of incident are you reporting, like a workplace injury or something else?', 'Was any property damaged? If so, could you describe it?', 'Were there any witnesses around?', 'Could you also provide the time and any injuries?', 'On a scale of minor to severe, how would you classify the incident?']","['I provided myself with some first aid.', 'We could really use some better floor mats in here.', 'Just one person was affected, me.', 'My name is Dr. Li Wei, my email is liwei@medicalemail.com, and this happened on February 15th, 2023.', 'It happened in one of the hospital rooms.', ""I'm reporting a workplace injury."", 'No property was damaged.', 'There were no witnesses.', 'It happened at 2:30pm. I sustained a sprained ankle.', ""I'd say it was a moderate incident.""]","{'immediate_actions_taken': 'provided myself with some first aid', 'additional_notes': 'We could really use some better floor mats in here', 'affected_individuals': 'one', 'reporter_contact_info': 'Dr. Li Wei', 'incident_date': 'February 15th, 2023', 'incident_location': 'in one of the hospital rooms', 'incident_type': 'workplace injury', 'property_damage': 'No', 'witnesses': 'no', 'incident_time': '2:30pm', 'injuries_sustained': 'a sprained ankle', 'severity_of_incident': 'moderate'}"
safety_incident_report,"[0, 1, 0, 1, 0, 1, 0, 1, 0, 1, 0, 1, 0, 1]","['HR Assistant: Okay, let me help walk through this. Were there any other people around when it happened? ', 'Employee: No, there were no other witnesses to the incident. ', 'HR Assistant: Thanks for letting me know. Do you have any other details or observations you think would be helpful to include? What did you do right after it occurred?', 'Employee: I administered first aid to the student who had tripped. ', 'HR Assistant: I appreciate you taking the time to fill out an incident report. Could you please provide your contact information and how many people were involved?', 'Employee: My name is Angela Thomas, my email is athomas@school.edu, and my phone number is 1. ', 'HR Assistant: To make sure I have all the necessary information, could you tell me what type of incident it was and when it happened? ', 'Employee: It was a workplace injury that occurred at 2:30 pm.', 'HR Assistant: Thank you. On a scale of minor to severe, how would you classify the incident? Was any property damaged?', 'Employee: The incident was moderate and there was no property damage.', 'HR Assistant: Just a couple more questions - when did this take place and where was the exact location?', 'Employee: The incident occurred on February 15, 2023 in one of the classrooms.', ""HR Assistant: I'm sorry to hear someone was injured. Could you please describe the nature of the injuries?"", 'Employee: The student sustained a sprained ankle.']","[{'witnesses': 'No, there were no other witnesses'}, {'additional_notes': 'I administered first aid to the student who had tripped', 'immediate_actions_taken': 'first aid'}, {'reporter_contact_info': 'Angela Thomas', 'affected_individuals': '1'}, {'incident_type': 'workplace injury', 'incident_time': '2:30 pm'}, {'severity_of_incident': 'moderate', 'property_damage': 'no'}, {'incident_date': 'February 15, 2023', 'incident_location': 'in one of the classrooms'}, {'injuries_sustained': 'a sprained ankle'}]","['Okay, let me help walk through this. Were there any other people around when it happened?', 'Thanks for letting me know. Do you have any other details or observations you think would be helpful to include? What did you do right after it occurred?', 'I appreciate you taking the time to fill out an incident report. Could you please provide your contact information and how many people were involved?', 'To make sure I have all the necessary information, could you tell me what type of incident it was and when it happened?', 'Thank you. On a scale of minor to severe, how would you classify the incident? Was any property damaged?', 'Just a couple more questions - when did this take place and where was the exact location?', ""I'm sorry to hear someone was injured. Could you please describe the nature of the injuries?""]","['No, there were no other witnesses to the incident.', 'I administered first aid to the student who had tripped.', 'My name is Angela Thomas, my email is athomas@school.edu, and my phone number is 1.', 'It was a workplace injury that occurred at 2:30 pm.', 'The incident was moderate and there was no property damage.', 'The incident occurred on February 15, 2023 in one of the classrooms.', 'The student sustained a sprained ankle.']","{'witnesses': 'No, there were no other witnesses', 'additional_notes': 'I administered first aid to the student who had tripped', 'immediate_actions_taken': 'first aid', 'reporter_contact_info': 'Angela Thomas', 'affected_individuals': '1', 'incident_type': 'workplace injury', 'incident_time': '2:30 pm', 'severity_of_incident': 'moderate', 'property_damage': 'no', 'incident_date': 'February 15, 2023', 'incident_location': 'in one of the classrooms', 'injuries_sustained': 'a sprained ankle'}"
