service,speaker,utterance,state,HR_message,Employee_message,entities
safety_incident_report,"[0, 1, 0, 1, 0, 1, 0, 1, 0, 1, 0, 1, 0, 1, 0, 1]","['HR Assistant: No problem, let me know what happened. Were there any other details you wanted to add about the situation?', 'Employee: No, there were no additional notes.', 'HR Assistant: Okay, no worries. What type of incident occurred exactly? Something like an injury, fire or hazardous spill?  ', 'Employee: It was a workplace injury.', 'HR Assistant: Got it. Can you provide me with your contact info so I have it on file? Your name, email and phone number will do.', 'Employee: My name is Carlos Mendez and my phone number is 555-0102.', 'HR Assistant: Thanks Carlos. What immediate steps did you take after it happened? Also, how many people were involved in the incident?', 'Employee: First aid was administered, and it affected one person.  ', 'HR Assistant: When did this all go down exactly? And were there any injuries as a result?', 'Employee: The date was 2023-02-15, and I sprained my ankle.', 'HR Assistant: Ouch, sorry to hear that. Was any equipment or property damaged in the incident?', 'Employee: No, there was no property damage.', 'HR Assistant: Last couple questions - where did this all happen and what time of day?', 'Employee: It occurred in the office at 10:00 AM.', 'HR Assistant: Almost done, just need to know how serious it was on a scale of minor to severe. Also, was anyone a witness?', 'Employee: It was moderate in severity and there were no witnesses.']","[{'additional_notes': 'No, there were no additional notes'}, {'incident_type': 'workplace injury'}, {'reporter_contact_info': 'Carlos Mendez'}, {'immediate_actions_taken': 'First aid', 'affected_individuals': 'one'}, {'incident_date': '2023-02-15', 'injuries_sustained': 'sprained my ankle'}, {'property_damage': 'No'}, {'incident_location': 'in the office', 'incident_time': '10:00 AM'}, {'severity_of_incident': 'moderate', 'witnesses': 'no witnesses'}]","['No problem, let me know what happened. Were there any other details you wanted to add about the situation?', 'Okay, no worries. What type of incident occurred exactly? Something like an injury, fire or hazardous spill?', 'Got it. Can you provide me with your contact info so I have it on file? Your name, email and phone number will do.', 'Thanks Carlos. What immediate steps did you take after it happened? Also, how many people were involved in the incident?', 'When did this all go down exactly? And were there any injuries as a result?', 'Ouch, sorry to hear that. Was any equipment or property damaged in the incident?', 'Last couple questions - where did this all happen and what time of day?', 'Almost done, just need to know how serious it was on a scale of minor to severe. Also, was anyone a witness?']","['No, there were no additional notes.', 'It was a workplace injury.', 'My name is Carlos Mendez and my phone number is 555-0102.', 'First aid was administered, and it affected one person.', 'The date was 2023-02-15, and I sprained my ankle.', 'No, there was no property damage.', 'It occurred in the office at 10:00 AM.', 'It was moderate in severity and there were no witnesses.']","{'additional_notes': 'No, there were no additional notes', 'incident_type': 'workplace injury', 'reporter_contact_info': 'Carlos Mendez', 'immediate_actions_taken': 'First aid', 'affected_individuals': 'one', 'incident_date': '2023-02-15', 'injuries_sustained': 'sprained my ankle', 'property_damage': 'No', 'incident_location': 'in the office', 'incident_time': '10:00 AM', 'severity_of_incident': 'moderate', 'witnesses': 'no witnesses'}"
safety_incident_report,"[0, 1, 0, 1, 0, 1, 0, 1, 0, 1, 0, 1, 0, 1, 0, 1]","[""HR Assistant: Oh no, I'm sorry to hear that. Can you tell me your name, email and phone number so I have your contact details? "", 'Employee: My name is Sofia Alvarez, my email is salvarez@lawfirm.com.', 'HR Assistant: Thanks Sofia. Were you hurt at all in the accident? If so, could you describe your injuries to me?', 'Employee: Yes, I sprained my ankle.', 'HR Assistant: I see, thanks for letting me know. What did you do right after it happened? Was there any property damage?', 'Employee: I got some first aid for my ankle. There was no property damage.  ', 'HR Assistant: Okay, thanks. What type of incident are you reporting - like a workplace injury, fire or hazardous spill? Also, how many people were involved?', 'Employee: It was a workplace injury and only I was affected.', 'HR Assistant: No problem. When exactly did it occur? Could you give me the date and time?', 'Employee: It occurred on February 15, 2023 at 10:30 AM.', 'HR Assistant: Got it. On a scale of minor to severe, how bad was the incident?  ', 'Employee: It was moderate.', 'HR Assistant: Were there any witnesses to what happened? Or were you alone at the time?', 'Employee: No, there were no witnesses. ', 'HR Assistant: One last thing - is there anything else you want to add? Also, could you tell me where exactly it took place?', ""Employee: We need better floor mats in the office. That's where it happened.""]","[{'reporter_contact_info': 'Sofia Alvarez'}, {'injuries_sustained': 'sprained my ankle'}, {'immediate_actions_taken': 'first aid', 'property_damage': 'no'}, {'incident_type': 'workplace injury', 'affected_individuals': 'only I was affected'}, {'incident_date': 'February 15, 2023', 'incident_time': '10:30 AM'}, {'severity_of_incident': 'moderate'}, {'witnesses': 'No, there were no witnesses'}, {'additional_notes': 'We need better floor mats in the office', 'incident_location': 'the office'}]","[""Oh no, I'm sorry to hear that. Can you tell me your name, email and phone number so I have your contact details?"", 'Thanks Sofia. Were you hurt at all in the accident? If so, could you describe your injuries to me?', 'I see, thanks for letting me know. What did you do right after it happened? Was there any property damage?', 'Okay, thanks. What type of incident are you reporting - like a workplace injury, fire or hazardous spill? Also, how many people were involved?', 'No problem. When exactly did it occur? Could you give me the date and time?', 'Got it. On a scale of minor to severe, how bad was the incident?', 'Were there any witnesses to what happened? Or were you alone at the time?', 'One last thing - is there anything else you want to add? Also, could you tell me where exactly it took place?']","['My name is Sofia Alvarez, my email is salvarez@lawfirm.com.', 'Yes, I sprained my ankle.', 'I got some first aid for my ankle. There was no property damage.', 'It was a workplace injury and only I was affected.', 'It occurred on February 15, 2023 at 10:30 AM.', 'It was moderate.', 'No, there were no witnesses.', ""We need better floor mats in the office. That's where it happened.""]","{'reporter_contact_info': 'Sofia Alvarez', 'injuries_sustained': 'sprained my ankle', 'immediate_actions_taken': 'first aid', 'property_damage': 'no', 'incident_type': 'workplace injury', 'affected_individuals': 'only I was affected', 'incident_date': 'February 15, 2023', 'incident_time': '10:30 AM', 'severity_of_incident': 'moderate', 'witnesses': 'No, there were no witnesses', 'additional_notes': 'We need better floor mats in the office', 'incident_location': 'the office'}"
safety_incident_report,"[0, 1, 0, 1, 0, 1, 0, 1, 0, 1, 0, 1, 0, 1]","['HR Assistant: No problem, let me know what immediate actions were taken after the incident. About how many people were affected by what happened?', 'Employee: First aid was administered, and it looks like one person was involved.  ', 'HR Assistant: I see. Would you say the incident was minor, moderate or severe? What type of safety issue are you reporting?  ', ""Employee: It was moderate, I'm reporting a workplace injury."", 'HR Assistant: Okay, were there any witnesses around who saw what happened?  ', 'Employee: John Smith was there.', 'HR Assistant: When did this all take place? And feel free to add any other details or observations you have.', 'Employee: It occurred on February 15th, 2023. I think we may need some better floor mats in the office.  ', 'HR Assistant: Could you tell me where exactly the incident happened? And do you remember around what time of day it was?', 'Employee: It was in the office at 10:00 AM.', 'HR Assistant: Was any equipment or property damaged? If so, please describe. ', 'Employee: No, there was no property damage.', 'HR Assistant: Lastly, can you provide your contact info like name, email and phone number? And were there any injuries as a result of the incident?', 'Employee: My name is Sofia Alvarez, you can reach me at salvarez@lawfirm.com or 555-1234. I sprained my ankle.']","[{'immediate_actions_taken': 'First aid was administered', 'affected_individuals': 'one'}, {'severity_of_incident': 'moderate', 'incident_type': 'workplace injury'}, {'witnesses': 'John Smith was there'}, {'incident_date': 'February 15th, 2023', 'additional_notes': 'I think we may need some better floor mats in the office'}, {'incident_location': 'in the office', 'incident_time': '10:00 AM'}, {'property_damage': 'No'}, {'reporter_contact_info': '555-1234', 'injuries_sustained': 'sprained my ankle'}]","['No problem, let me know what immediate actions were taken after the incident. About how many people were affected by what happened?', 'I see. Would you say the incident was minor, moderate or severe? What type of safety issue are you reporting?', 'Okay, were there any witnesses around who saw what happened?', 'When did this all take place? And feel free to add any other details or observations you have.', 'Could you tell me where exactly the incident happened? And do you remember around what time of day it was?', 'Was any equipment or property damaged? If so, please describe.', 'Lastly, can you provide your contact info like name, email and phone number? And were there any injuries as a result of the incident?']","['First aid was administered, and it looks like one person was involved.', ""It was moderate, I'm reporting a workplace injury."", 'John Smith was there.', 'It occurred on February 15th, 2023. I think we may need some better floor mats in the office.', 'It was in the office at 10:00 AM.', 'No, there was no property damage.', 'My name is Sofia Alvarez, you can reach me at salvarez@lawfirm.com or 555-1234. I sprained my ankle.']","{'immediate_actions_taken': 'First aid was administered', 'affected_individuals': 'one', 'severity_of_incident': 'moderate', 'incident_type': 'workplace injury', 'witnesses': 'John Smith was there', 'incident_date': 'February 15th, 2023', 'additional_notes': 'I think we may need some better floor mats in the office', 'incident_location': 'in the office', 'incident_time': '10:00 AM', 'property_damage': 'No', 'reporter_contact_info': '555-1234', 'injuries_sustained': 'sprained my ankle'}"
safety_incident_report,"[0, 1, 0, 1, 0, 1, 0, 1, 0, 1, 0, 1, 0, 1, 0, 1]","['HR Assistant: No problem, let me know if you need any clarification or have additional details to add. What happened during the incident?', 'Employee: I cut my hand while working in the lab and need better safety equipment.  ', ""HR Assistant: I'm sorry to hear that. On a scale of minor to severe, how would you rate the incident?"", 'Employee: The incident was moderate.', 'HR Assistant: When did this occur? Please provide the time in HH:MM format. Were you injured at all?', 'Employee: The incident occurred at 14:30. I received a cut on my hand.', 'HR Assistant: About how many people were involved? Just yourself?', 'Employee: Just one person was affected, myself.', 'HR Assistant: Could you tell me where exactly this took place? Also, please provide your contact info so I can note it down.', 'Employee: The incident occurred in Lab room 23B. My name is Henry Kim, my email is hkim@researchlab.com, and my phone number is 555-1234.', 'HR Assistant: Thanks for providing those details. Could you let me know what type of incident it was and if any immediate actions were taken after? I want to make sure I have all the information.', 'Employee: It was a workplace injury. I administered first aid after it happened.', 'HR Assistant: Just one more question - do you remember the date? Also, was any property damaged? ', 'Employee: The date was 2023-02-15. There was no property damage.', 'HR Assistant: Okay, last question - were there any witnesses?', 'Employee: There were no witnesses to the incident.']","[{'additional_notes': 'need better safety equipment'}, {'severity_of_incident': 'moderate'}, {'incident_time': '14:30', 'injuries_sustained': 'a cut on my hand'}, {'affected_individuals': 'one'}, {'incident_location': 'Lab room 23B', 'reporter_contact_info': '555-1234'}, {'incident_type': 'workplace injury', 'immediate_actions_taken': 'first aid'}, {'incident_date': '2023-02-15', 'property_damage': 'no'}, {'witnesses': 'no'}]","['No problem, let me know if you need any clarification or have additional details to add. What happened during the incident?', ""I'm sorry to hear that. On a scale of minor to severe, how would you rate the incident?"", 'When did this occur? Please provide the time in HH:MM format. Were you injured at all?', 'About how many people were involved? Just yourself?', 'Could you tell me where exactly this took place? Also, please provide your contact info so I can note it down.', 'Thanks for providing those details. Could you let me know what type of incident it was and if any immediate actions were taken after? I want to make sure I have all the information.', 'Just one more question - do you remember the date? Also, was any property damaged?', 'Okay, last question - were there any witnesses?']","['I cut my hand while working in the lab and need better safety equipment.', 'The incident was moderate.', 'The incident occurred at 14:30. I received a cut on my hand.', 'Just one person was affected, myself.', 'The incident occurred in Lab room 23B. My name is Henry Kim, my email is hkim@researchlab.com, and my phone number is 555-1234.', 'It was a workplace injury. I administered first aid after it happened.', 'The date was 2023-02-15. There was no property damage.', 'There were no witnesses to the incident.']","{'additional_notes': 'need better safety equipment', 'severity_of_incident': 'moderate', 'incident_time': '14:30', 'injuries_sustained': 'a cut on my hand', 'affected_individuals': 'one', 'incident_location': 'Lab room 23B', 'reporter_contact_info': '555-1234', 'incident_type': 'workplace injury', 'immediate_actions_taken': 'first aid', 'incident_date': '2023-02-15', 'property_damage': 'no', 'witnesses': 'no'}"
safety_incident_report,"[0, 1, 0, 1, 0, 1, 0, 1, 0, 1, 0, 1, 0, 1]","['HR Assistant: No problem, were there any other observations you want to include that might help improve safety?', 'Employee: We need better floor mats to prevent slips.  ', 'HR Assistant: Got it. Was anything damaged in the incident? If so, can you tell me what happened?', 'Employee: Nothing was damaged.', 'HR Assistant: Thanks for letting me know. On a scale of minor to severe, how would you rate the incident? Also, what time did it occur?', 'Employee: I would say it was moderate. The incident happened at 2:30 pm.', ""HR Assistant: Okay, when exactly did this take place? Could you also tell me if you or anyone else was hurt during the incident? I'm here to help however I can."", 'Employee: It happened on February 15th, 2023. I sprained my ankle.', ""HR Assistant: I'm sorry to hear that. About how many people were involved? And where did it happen specifically so I can include the right location?"", 'Employee: Just me, and it was on the warehouse floor.', 'HR Assistant: Were there any witnesses? And lastly, what kind of safety incident are we reporting - like a workplace injury?', 'Employee: John Smith witnessed it. This is a report for a workplace injury.', 'HR Assistant: Almost done, just a couple more questions. What first aid did you receive after? Also, can you provide your contact details like name, email and phone number?', 'Employee: I administered first aid. My name is Jordan Casey, email is jcasey@email.com and phone number is 555-0234.']","[{'additional_notes': 'We need better floor mats to prevent slips'}, {'property_damage': 'Nothing'}, {'severity_of_incident': 'moderate', 'incident_time': '2:30 pm'}, {'incident_date': 'February 15th, 2023', 'injuries_sustained': 'sprained my ankle'}, {'affected_individuals': 'Just me', 'incident_location': 'on the warehouse floor'}, {'witnesses': 'John Smith witnessed it', 'incident_type': 'workplace injury'}, {'immediate_actions_taken': 'first aid', 'reporter_contact_info': 'jcasey@email.com and phone number is 555-0234'}]","['No problem, were there any other observations you want to include that might help improve safety?', 'Got it. Was anything damaged in the incident? If so, can you tell me what happened?', 'Thanks for letting me know. On a scale of minor to severe, how would you rate the incident? Also, what time did it occur?', ""Okay, when exactly did this take place? Could you also tell me if you or anyone else was hurt during the incident? I'm here to help however I can."", ""I'm sorry to hear that. About how many people were involved? And where did it happen specifically so I can include the right location?"", 'Were there any witnesses? And lastly, what kind of safety incident are we reporting - like a workplace injury?', 'Almost done, just a couple more questions. What first aid did you receive after? Also, can you provide your contact details like name, email and phone number?']","['We need better floor mats to prevent slips.', 'Nothing was damaged.', 'I would say it was moderate. The incident happened at 2:30 pm.', 'It happened on February 15th, 2023. I sprained my ankle.', 'Just me, and it was on the warehouse floor.', 'John Smith witnessed it. This is a report for a workplace injury.', 'I administered first aid. My name is Jordan Casey, email is jcasey@email.com and phone number is 555-0234.']","{'additional_notes': 'We need better floor mats to prevent slips', 'property_damage': 'Nothing', 'severity_of_incident': 'moderate', 'incident_time': '2:30 pm', 'incident_date': 'February 15th, 2023', 'injuries_sustained': 'sprained my ankle', 'affected_individuals': 'Just me', 'incident_location': 'on the warehouse floor', 'witnesses': 'John Smith witnessed it', 'incident_type': 'workplace injury', 'immediate_actions_taken': 'first aid', 'reporter_contact_info': 'jcasey@email.com and phone number is 555-0234'}"
safety_incident_report,"[0, 1, 0, 1, 0, 1, 0, 1, 0, 1, 0, 1, 0, 1, 0, 1]","[""HR Assistant: No problem, let's take a look. What type of incident happened? Was it an injury, fire or hazardous spill?"", 'Employee: It was a workplace injury. ', 'HR Assistant: Okay, was any property damaged? If so, can you tell me what happened? Also, do you remember what time the incident occurred?', 'Employee: No, there was no property damage. It happened at 2:30pm.', 'HR Assistant: I see. Where exactly did the incident take place so I have an accurate location?  ', 'Employee: It occurred in the warehouse.', 'HR Assistant: Thanks for letting me know. On a scale of minor to severe, how bad was the injury?', 'Employee: It was moderate.', ""HR Assistant: Sorry to hear that. Did you sustain any injuries? If you don't mind sharing details, it will help with the report."", 'Employee: Yes, I sprained my ankle.', 'HR Assistant: Were there any witnesses? Or were you alone at the time? Also, what first aid actions were provided after the incident occurred?', 'Employee: John Smith witnessed it. First aid was administered. ', 'HR Assistant: Okay, just need your contact info to attach to the report. Can you provide your name, email, phone number and the date of the incident? ', 'Employee: My name is Jordan Casey, email is jordan.casey@email.com, phone number is 555-0234, and the date was February 15, 2023.', 'HR Assistant: Last couple questions - how many people in total were involved? And is there anything else I should know to include?', 'Employee: Just me, and there needs to be better lighting in the warehouse.']","[{'incident_type': 'workplace injury'}, {'property_damage': 'No, there was no property damage. It happened at 2:30pm', 'incident_time': '2:30pm'}, {'incident_location': 'in the warehouse'}, {'severity_of_incident': 'moderate'}, {'injuries_sustained': 'sprained my ankle'}, {'witnesses': 'John Smith', 'immediate_actions_taken': 'First aid was administered'}, {'reporter_contact_info': '555-0234', 'incident_date': 'February 15, 2023'}, {'affected_individuals': 'Just me', 'additional_notes': 'Just me, and there needs to be better lighting in the warehouse'}]","[""No problem, let's take a look. What type of incident happened? Was it an injury, fire or hazardous spill?"", 'Okay, was any property damaged? If so, can you tell me what happened? Also, do you remember what time the incident occurred?', 'I see. Where exactly did the incident take place so I have an accurate location?', 'Thanks for letting me know. On a scale of minor to severe, how bad was the injury?', ""Sorry to hear that. Did you sustain any injuries? If you don't mind sharing details, it will help with the report."", 'Were there any witnesses? Or were you alone at the time? Also, what first aid actions were provided after the incident occurred?', 'Okay, just need your contact info to attach to the report. Can you provide your name, email, phone number and the date of the incident?', 'Last couple questions - how many people in total were involved? And is there anything else I should know to include?']","['It was a workplace injury.', 'No, there was no property damage. It happened at 2:30pm.', 'It occurred in the warehouse.', 'It was moderate.', 'Yes, I sprained my ankle.', 'John Smith witnessed it. First aid was administered.', 'My name is Jordan Casey, email is jordan.casey@email.com, phone number is 555-0234, and the date was February 15, 2023.', 'Just me, and there needs to be better lighting in the warehouse.']","{'incident_type': 'workplace injury', 'property_damage': 'No, there was no property damage. It happened at 2:30pm', 'incident_time': '2:30pm', 'incident_location': 'in the warehouse', 'severity_of_incident': 'moderate', 'injuries_sustained': 'sprained my ankle', 'witnesses': 'John Smith', 'immediate_actions_taken': 'First aid was administered', 'reporter_contact_info': '555-0234', 'incident_date': 'February 15, 2023', 'affected_individuals': 'Just me', 'additional_notes': 'Just me, and there needs to be better lighting in the warehouse'}"
