service,speaker,utterance,state,HR_message,Employee_message,entities
performance_review,"[0, 1, 0, 1, 0, 1, 0, 1, 0, 1, 0, 1, 0, 1, 0, 1]","['HR Assistant: No problem, what areas do you think could use some improvement for this employee? Do you think they might benefit from any additional training?', 'Employee: I think they could work on time management skills. No additional training is needed.', ""HR Assistant: That's understandable. What kind of goals do you think would be good to set for them to work towards in the next review period?  "", 'Employee: Increasing their output would be a good goal.', ""HR Assistant: Got it. On a scale of 1 to 5, how would you rate the employee's contributions to team projects, with 5 being the highest? Do they exhibit any strong leadership qualities?"", ""Employee: I'd rate them a 4. They're quite creative and can influence others."", 'HR Assistant: Thanks for sharing. On a scale of 1 to 5, how well do you think the employee achieved the goals that were previously set for them, with 5 being very well?', ""Employee: I'd say they achieved the goals very well at a 5."", ""HR Assistant: No problem. What is the name of the employee you're reviewing?"", ""Employee: The employee's name is Alex Jordan. "", ""HR Assistant: It's great you're focusing on their development. In what ways have you seen the employee's skills grow or learn over the review period?"", ""Employee: I've seen Alex improve their artistic skills."", ""HR Assistant: Got it, and what is Alex's role or job position?"", ""Employee: Alex's job position is an Artist."", ""HR Assistant: Just a couple more questions - what is the time period covered by this review? And overall, how would you rate the employee's performance during this time on a scale of 1 to 5?"", ""Employee: The time period for this review is January 1st, 2023 to December 31st, 2023. Overall, I'd rate their performance a 5.""]","[{'areas_for_improvement': 'time management skills', 'additional_training_needed': 'No'}, {'next_review_goals': 'Increasing their output'}, {'team_contribution': '4', 'leadership_qualities': 'can influence others'}, {'goal_achievement': 'very well'}, {'employee_name': 'Alex Jordan'}, {'skill_development': 'artistic skills'}, {'job_role': 'Artist'}, {'review_period': 'January 1st, 2023 to December 31st, 2023', 'overall_performance_rating': '5'}]","['No problem, what areas do you think could use some improvement for this employee? Do you think they might benefit from any additional training?', ""That's understandable. What kind of goals do you think would be good to set for them to work towards in the next review period?"", ""Got it. On a scale of 1 to 5, how would you rate the employee's contributions to team projects, with 5 being the highest? Do they exhibit any strong leadership qualities?"", 'Thanks for sharing. On a scale of 1 to 5, how well do you think the employee achieved the goals that were previously set for them, with 5 being very well?', ""No problem. What is the name of the employee you're reviewing?"", ""It's great you're focusing on their development. In what ways have you seen the employee's skills grow or learn over the review period?"", ""Got it, and what is Alex's role or job position?"", ""Just a couple more questions - what is the time period covered by this review? And overall, how would you rate the employee's performance during this time on a scale of 1 to 5?""]","['I think they could work on time management skills. No additional training is needed.', 'Increasing their output would be a good goal.', ""I'd rate them a 4. They're quite creative and can influence others."", ""I'd say they achieved the goals very well at a 5."", ""The employee's name is Alex Jordan."", ""I've seen Alex improve their artistic skills."", ""Alex's job position is an Artist."", ""The time period for this review is January 1st, 2023 to December 31st, 2023. Overall, I'd rate their performance a 5.""]","{'areas_for_improvement': 'time management skills', 'additional_training_needed': 'No', 'next_review_goals': 'Increasing their output', 'team_contribution': '4', 'leadership_qualities': 'can influence others', 'goal_achievement': 'very well', 'employee_name': 'Alex Jordan', 'skill_development': 'artistic skills', 'job_role': 'Artist', 'review_period': 'January 1st, 2023 to December 31st, 2023', 'overall_performance_rating': '5'}"
performance_review,"[0, 1, 0, 1, 0, 1, 0, 1, 0, 1, 0, 1, 0, 1]","['HR Assistant: No problem, what kind of goals were you thinking of for next year?', ""Employee: I'd like to lead a project next year.  "", 'HR Assistant: Sounds good! On a scale of 1 to 5, with 5 being the highest, how would you rate your overall performance for this past review period?  ', ""Employee: I'd say my performance was about a 4."", ""HR Assistant: Great work! What's your current job role and how have your skills developed this year?"", 'Employee: My job role is software developer. This year, I learned some new frameworks that have really helped me improve.', ""HR Assistant: That's great to hear. What time period did this review cover, and are there any areas you think you could improve on going forward?"", 'Employee: This review was for the past year, from 2021 to 2022. One thing I think I could work on is my time management.', 'HR Assistant: No problem, we all have areas to improve. On a scale of 1 to 5, how well do you feel you achieved the goals that were set for you last review?', ""Employee: I'd rate myself about a 4 for achieving my previous goals. "", 'HR Assistant: Wonderful. Do you feel you need any additional training, and have you shown any leadership qualities over this past year?', ""Employee: I don't think I need any additional training. However, I have enjoyed mentoring some of the more junior developers."", ""HR Assistant: Almost done! What's your name and on a scale of 1 to 5, how would you rate your contribution to team projects over this past year?"", ""Employee: My name is Priya Singh. I'd rate my contribution to team projects as a 5.""]","[{'next_review_goals': 'lead a project'}, {'overall_performance_rating': '4'}, {'job_role': 'software developer', 'skill_development': 'I learned some new frameworks'}, {'review_period': '2021 to 2022', 'areas_for_improvement': 'time management'}, {'goal_achievement': '4'}, {'additional_training_needed': 'mentoring some of the more junior developers', 'leadership_qualities': 'mentoring some of the more junior developers'}, {'employee_name': 'Priya Singh', 'team_contribution': '5'}]","['No problem, what kind of goals were you thinking of for next year?', 'Sounds good! On a scale of 1 to 5, with 5 being the highest, how would you rate your overall performance for this past review period?', ""Great work! What's your current job role and how have your skills developed this year?"", ""That's great to hear. What time period did this review cover, and are there any areas you think you could improve on going forward?"", 'No problem, we all have areas to improve. On a scale of 1 to 5, how well do you feel you achieved the goals that were set for you last review?', 'Wonderful. Do you feel you need any additional training, and have you shown any leadership qualities over this past year?', ""Almost done! What's your name and on a scale of 1 to 5, how would you rate your contribution to team projects over this past year?""]","[""I'd like to lead a project next year."", ""I'd say my performance was about a 4."", 'My job role is software developer. This year, I learned some new frameworks that have really helped me improve.', 'This review was for the past year, from 2021 to 2022. One thing I think I could work on is my time management.', ""I'd rate myself about a 4 for achieving my previous goals."", ""I don't think I need any additional training. However, I have enjoyed mentoring some of the more junior developers."", ""My name is Priya Singh. I'd rate my contribution to team projects as a 5.""]","{'next_review_goals': 'lead a project', 'overall_performance_rating': '4', 'job_role': 'software developer', 'skill_development': 'I learned some new frameworks', 'review_period': '2021 to 2022', 'areas_for_improvement': 'time management', 'goal_achievement': '4', 'additional_training_needed': 'mentoring some of the more junior developers', 'leadership_qualities': 'mentoring some of the more junior developers', 'employee_name': 'Priya Singh', 'team_contribution': '5'}"
performance_review,"[0, 1, 0, 1, 0, 1, 0, 1, 0, 1, 0, 1, 0, 1, 0, 1, 0, 1]","[""HR Assistant: Okay, no problem. How would you describe the employee's contribution to team projects on a scale of 1 to 5, with 5 being the highest?"", 'Employee: The employee contributed greatly to team projects, earning a 5.', ""HR Assistant: Got it. What is the name of the employee you're reviewing?  "", ""Employee: The employee's name is Amir Khaled."", 'HR Assistant: Thanks. On a scale of 1 to 5, how well did Amir achieve the goals that were set for them, with 5 being very well?', 'Employee: Amir achieved their goals well, earning a 4.  ', ""HR Assistant: That's good to hear. What is Amir's job role?"", ""Employee: Amir's job role is chef."", 'HR Assistant: Great. Could you please describe any skills or learning that Amir has developed?', 'Employee: Amir learned new cooking dishes.', 'HR Assistant: Okay, thanks for sharing. In your opinion, is there any additional training that would benefit Amir?', 'Employee: Additional pastry skills training would benefit Amir.', 'HR Assistant: Wonderful. Has Amir exhibited any leadership qualities, such as mentoring others? Also, what is the time period for this review?', 'Employee: Amir has mentored junior chefs over the past year.', ""HR Assistant: That's awesome. What goals do you think should be set for Amir for the next review period?  "", 'Employee: A goal could be for Amir to lead the team for an upcoming event.', ""HR Assistant: Almost done. In your view, are there any areas Amir could improve in? Also, what would you rate Amir's overall performance?"", ""Employee: Amir could improve time management skills. Amir's overall performance rating is 4.""]","[{'team_contribution': 'greatly'}, {'employee_name': 'Amir Khaled'}, {'goal_achievement': '4'}, {'job_role': 'chef'}, {'skill_development': 'learned new cooking dishes'}, {'additional_training_needed': 'pastry skills'}, {'leadership_qualities': 'mentored junior chefs', 'review_period': 'year'}, {'next_review_goals': 'A goal could be for Amir to lead the team for an upcoming event'}, {'areas_for_improvement': 'time management skills', 'overall_performance_rating': '4'}]","[""Okay, no problem. How would you describe the employee's contribution to team projects on a scale of 1 to 5, with 5 being the highest?"", ""Got it. What is the name of the employee you're reviewing?"", 'Thanks. On a scale of 1 to 5, how well did Amir achieve the goals that were set for them, with 5 being very well?', ""That's good to hear. What is Amir's job role?"", 'Great. Could you please describe any skills or learning that Amir has developed?', 'Okay, thanks for sharing. In your opinion, is there any additional training that would benefit Amir?', 'Wonderful. Has Amir exhibited any leadership qualities, such as mentoring others? Also, what is the time period for this review?', ""That's awesome. What goals do you think should be set for Amir for the next review period?"", ""Almost done. In your view, are there any areas Amir could improve in? Also, what would you rate Amir's overall performance?""]","['The employee contributed greatly to team projects, earning a 5.', ""The employee's name is Amir Khaled."", 'Amir achieved their goals well, earning a 4.', ""Amir's job role is chef."", 'Amir learned new cooking dishes.', 'Additional pastry skills training would benefit Amir.', 'Amir has mentored junior chefs over the past year.', 'A goal could be for Amir to lead the team for an upcoming event.', ""Amir could improve time management skills. Amir's overall performance rating is 4.""]","{'team_contribution': 'greatly', 'employee_name': 'Amir Khaled', 'goal_achievement': '4', 'job_role': 'chef', 'skill_development': 'learned new cooking dishes', 'additional_training_needed': 'pastry skills', 'leadership_qualities': 'mentored junior chefs', 'review_period': 'year', 'next_review_goals': 'A goal could be for Amir to lead the team for an upcoming event', 'areas_for_improvement': 'time management skills', 'overall_performance_rating': '4'}"
performance_review,"[0, 1, 0, 1, 0, 1, 0, 1, 0, 1, 0, 1, 0, 1, 0, 1]","[""HR Assistant: Okay, no problem. How would you rate Sofia's overall performance on a scale of 1 to 5, with 5 being the highest? Also, are there any areas you think she could improve on?"", ""Employee: Sofia's overall performance has been excellent, rated 5. One area she might work on is her time management skills.  "", ""HR Assistant: That's great that her performance has been so strong. What kind of goals do you think would help Sofia improve her time management for the next review period?  "", 'Employee: The goal for Sofia should be to improve her time management skills.', ""HR Assistant: Could you tell me Sofia's name and job role so I have all the details?"", 'Employee: Sofia Alvarez is a lawyer.', 'HR Assistant: Has Sofia shown any leadership qualities in her role? It would be helpful to know.', 'Employee: Sofia has been a good leader and mentor.', 'HR Assistant: On a scale of 1 to 5, how well do you think Sofia achieved the goals that were set for her in her last review, with 5 being fully achieved?', 'Employee: Sofia fully achieved her goals, rated 5.', ""HR Assistant: Can you provide the time period that this review covers? It's helpful to include the dates."", 'Employee: This review covers the period from January 2023 to December 2023. ', ""HR Assistant: Has Sofia shown any learning or skill development over the review period? It's good to highlight any growth."", 'Employee: Sofia has shown a great ability to learn.', ""HR Assistant: On a scale of 1 to 5, how would you rate Sofia's contributions to team projects? Also, is there any additional training you think would benefit Sofia?"", 'Employee: Sofia receives a 5 for her contributions to team projects. Additional training in contract negotiation skills could help her.']","[{'overall_performance_rating': '5', 'areas_for_improvement': 'time management skills'}, {'next_review_goals': 'improve her time management skills'}, {'employee_name': 'Sofia Alvarez', 'job_role': 'lawyer'}, {'leadership_qualities': 'good leader and mentor'}, {'goal_achievement': 'fully'}, {'review_period': 'January 2023 to December 2023'}, {'skill_development': 'great ability to learn'}, {'team_contribution': '5', 'additional_training_needed': 'contract negotiation skills'}]","[""Okay, no problem. How would you rate Sofia's overall performance on a scale of 1 to 5, with 5 being the highest? Also, are there any areas you think she could improve on?"", ""That's great that her performance has been so strong. What kind of goals do you think would help Sofia improve her time management for the next review period?"", ""Could you tell me Sofia's name and job role so I have all the details?"", 'Has Sofia shown any leadership qualities in her role? It would be helpful to know.', 'On a scale of 1 to 5, how well do you think Sofia achieved the goals that were set for her in her last review, with 5 being fully achieved?', ""Can you provide the time period that this review covers? It's helpful to include the dates."", ""Has Sofia shown any learning or skill development over the review period? It's good to highlight any growth."", ""On a scale of 1 to 5, how would you rate Sofia's contributions to team projects? Also, is there any additional training you think would benefit Sofia?""]","[""Sofia's overall performance has been excellent, rated 5. One area she might work on is her time management skills."", 'The goal for Sofia should be to improve her time management skills.', 'Sofia Alvarez is a lawyer.', 'Sofia has been a good leader and mentor.', 'Sofia fully achieved her goals, rated 5.', 'This review covers the period from January 2023 to December 2023.', 'Sofia has shown a great ability to learn.', 'Sofia receives a 5 for her contributions to team projects. Additional training in contract negotiation skills could help her.']","{'overall_performance_rating': '5', 'areas_for_improvement': 'time management skills', 'next_review_goals': 'improve her time management skills', 'employee_name': 'Sofia Alvarez', 'job_role': 'lawyer', 'leadership_qualities': 'good leader and mentor', 'goal_achievement': 'fully', 'review_period': 'January 2023 to December 2023', 'skill_development': 'great ability to learn', 'team_contribution': '5', 'additional_training_needed': 'contract negotiation skills'}"
performance_review,"[0, 1, 0, 1, 0, 1, 0, 1, 0, 1, 0, 1, 0, 1]","[""HR Assistant: No problem, I'm happy to help. How would you rate Carlos's contributions to team projects? Please use a scale of 1 to 5, with 5 being the highest."", 'Employee: Carlos receives a 5 rating for his contributions to team projects. ', ""HR Assistant: Thanks for providing that rating. Now, how would you assess Carlos's overall performance? Again, please use a 1 to 5 scale."", ""Employee: I would rate Carlos's overall performance as a 4."", 'HR Assistant: Great, thank you for sharing that evaluation. Does Carlos need any additional training to further develop his skills?', 'Employee: Carlos could benefit from leadership training.', ""HR Assistant: Okay, I understand. Could you please describe any leadership qualities Carlos has shown and how well he achieved his set goals, using a 1 to 5 scale? I'm interested to learn more.  "", 'Employee: Carlos mentored junior engineers and achieved his set goals at a 4 rating.', ""HR Assistant: That's helpful feedback. Please tell me about any skill development or learning growth you've noticed from Carlos over the review period."", 'Employee: Carlos learned new skills during the past 12 months.', ""HR Assistant: Thanks for all this useful information. What time period does this review cover? Also, what goals do you think would be good to set for Carlos's next review?"", 'Employee: This review covers the past 12 months. A good goal for the next period would be for Carlos to complete his certification.', 'HR Assistant: Got it, thanks for providing that context. In what areas could Carlos improve and what is his job role?', 'Employee: Carlos could improve in time management skills. He works as an Engineer.']","[{'team_contribution': '5', 'employee_name': 'Carlos'}, {'overall_performance_rating': '4'}, {'additional_training_needed': 'leadership'}, {'leadership_qualities': 'Carlos mentored junior engineers and achieved his set goals at a 4 rating', 'goal_achievement': '4'}, {'skill_development': 'learned new skills'}, {'review_period': 'the past 12 months', 'next_review_goals': 'for Carlos to complete his certification'}, {'areas_for_improvement': 'time management skills', 'job_role': 'Engineer'}]","[""No problem, I'm happy to help. How would you rate Carlos's contributions to team projects? Please use a scale of 1 to 5, with 5 being the highest."", ""Thanks for providing that rating. Now, how would you assess Carlos's overall performance? Again, please use a 1 to 5 scale."", 'Great, thank you for sharing that evaluation. Does Carlos need any additional training to further develop his skills?', ""Okay, I understand. Could you please describe any leadership qualities Carlos has shown and how well he achieved his set goals, using a 1 to 5 scale? I'm interested to learn more."", ""That's helpful feedback. Please tell me about any skill development or learning growth you've noticed from Carlos over the review period."", ""Thanks for all this useful information. What time period does this review cover? Also, what goals do you think would be good to set for Carlos's next review?"", 'Got it, thanks for providing that context. In what areas could Carlos improve and what is his job role?']","['Carlos receives a 5 rating for his contributions to team projects.', ""I would rate Carlos's overall performance as a 4."", 'Carlos could benefit from leadership training.', 'Carlos mentored junior engineers and achieved his set goals at a 4 rating.', 'Carlos learned new skills during the past 12 months.', 'This review covers the past 12 months. A good goal for the next period would be for Carlos to complete his certification.', 'Carlos could improve in time management skills. He works as an Engineer.']","{'team_contribution': '5', 'employee_name': 'Carlos', 'overall_performance_rating': '4', 'additional_training_needed': 'leadership', 'leadership_qualities': 'Carlos mentored junior engineers and achieved his set goals at a 4 rating', 'goal_achievement': '4', 'skill_development': 'learned new skills', 'review_period': 'the past 12 months', 'next_review_goals': 'for Carlos to complete his certification', 'areas_for_improvement': 'time management skills', 'job_role': 'Engineer'}"
performance_review,"[0, 1, 0, 1, 0, 1, 0, 1, 0, 1, 0, 1, 0, 1]","['HR Assistant: What kind of additional training, if any, do you feel you might benefit from? Are there any areas you think you could improve on?', 'Employee: I think contract negotiations training could be helpful, and learning to maintain a better work life balance.  ', 'HR Assistant: What goals do you think would be good to focus on for the next review period? Over what time frame was this review done? (Enter the date range in YYYY-MM-DD format)', 'Employee: Leading more pro bono cases, and this review was for the past year.', 'HR Assistant: What is your role here?', ""Employee: I'm a lawyer. "", 'HR Assistant: What is your name?  ', 'Employee: My name is Sofia Alvarez.', 'HR Assistant: Were there any leadership qualities you demonstrated? Overall, how would you rate your performance? (Rate from 1 to 5)', 'Employee: I mentored some of the junior lawyers, and I believe I exceeded expectations.', 'HR Assistant: Did you show any growth in developing new skills or learning? How well do you feel you achieved the goals that were set for you? (Rate from 1 to 5)  ', 'Employee: I developed my litigation skills, and I think I fully achieved the goals that were set.', 'HR Assistant: How would you rate your contributions to any team projects? (Rate from 1 to 5)', 'Employee: I led some major cases.']","[{'additional_training_needed': 'contract negotiations', 'areas_for_improvement': 'learning to maintain a better work life balance'}, {'next_review_goals': 'Leading more pro bono cases', 'review_period': 'the past year'}, {'job_role': 'lawyer'}, {'employee_name': 'Sofia Alvarez'}, {'leadership_qualities': 'I mentored some of the junior lawyers, and I believe I exceeded expectations', 'overall_performance_rating': 'exceeded expectations'}, {'skill_development': 'I developed my litigation skills', 'goal_achievement': 'fully'}, {'team_contribution': 'led some major cases'}]","['What kind of additional training, if any, do you feel you might benefit from? Are there any areas you think you could improve on?', 'What goals do you think would be good to focus on for the next review period? Over what time frame was this review done? (Enter the date range in YYYY-MM-DD format)', 'What is your role here?', 'What is your name?', 'Were there any leadership qualities you demonstrated? Overall, how would you rate your performance? (Rate from 1 to 5)', 'Did you show any growth in developing new skills or learning? How well do you feel you achieved the goals that were set for you? (Rate from 1 to 5)', 'How would you rate your contributions to any team projects? (Rate from 1 to 5)']","['I think contract negotiations training could be helpful, and learning to maintain a better work life balance.', 'Leading more pro bono cases, and this review was for the past year.', ""I'm a lawyer."", 'My name is Sofia Alvarez.', 'I mentored some of the junior lawyers, and I believe I exceeded expectations.', 'I developed my litigation skills, and I think I fully achieved the goals that were set.', 'I led some major cases.']","{'additional_training_needed': 'contract negotiations', 'areas_for_improvement': 'learning to maintain a better work life balance', 'next_review_goals': 'Leading more pro bono cases', 'review_period': 'the past year', 'job_role': 'lawyer', 'employee_name': 'Sofia Alvarez', 'leadership_qualities': 'I mentored some of the junior lawyers, and I believe I exceeded expectations', 'overall_performance_rating': 'exceeded expectations', 'skill_development': 'I developed my litigation skills', 'goal_achievement': 'fully', 'team_contribution': 'led some major cases'}"
