service,speaker,utterance,state,HR_message,Employee_message,entities
safety_incident_report,"[0, 1, 0, 1, 0, 1, 0, 1, 0, 1, 0, 1, 0, 1, 0, 1]","[""HR Assistant: Oh no, I'm sorry to hear that. What kind of injury did you sustain? If you don't mind me asking, could you describe what happened?"", 'Employee: I sprained my ankle.', ""HR Assistant: Ouch, that doesn't sound fun. Was any property damaged during the incident as well? If so, could you let me know what was damaged?  "", 'Employee: There was no property damage.', 'HR Assistant: Okay, thanks for letting me know. About how many people were involved in the incident altogether?', 'Employee: Just one person was affected, me.', 'HR Assistant: I see. Do you mind telling me when this all took place? Also, what type of safety incident are you reporting, like a workplace injury, fire, or hazardous spill?', 'Employee: The incident occurred on February 15th, 2023 and it was a workplace injury. ', 'HR Assistant: Were there any other witnesses to what happened? And could you also provide the specific location where the incident took place?', 'Employee: John Smith witnessed it, and it occurred on the office floor 2.', 'HR Assistant: Thanks for providing that information. On a scale of minor, moderate, or severe, how would you classify the seriousness of the incident?  ', 'Employee: I would say it was moderate.', ""HR Assistant: I'm sorry to hear that. What initial actions did you take after the incident occurred? Also, could you please provide me with your contact details like your name, email, and phone number?"", 'Employee: First aid was administered. My name is Priya Singh, my email is priya.dev@techcorp.com.', 'HR Assistant: Just one more thing, do you mind sharing around what time the incident occurred? And are there any other notes or observations you want to include?', 'Employee: It happened at 10:30 AM. There are no additional notes.']","[{'injuries_sustained': 'sprained my ankle'}, {'property_damage': 'no'}, {'affected_individuals': 'one'}, {'incident_date': 'February 15th, 2023', 'incident_type': 'workplace injury'}, {'witnesses': 'John Smith', 'incident_location': 'office floor 2'}, {'severity_of_incident': 'moderate'}, {'immediate_actions_taken': 'First aid was administered', 'reporter_contact_info': 'Priya Singh'}, {'incident_time': '10:30 AM', 'additional_notes': 'no additional notes'}]","[""Oh no, I'm sorry to hear that. What kind of injury did you sustain? If you don't mind me asking, could you describe what happened?"", ""Ouch, that doesn't sound fun. Was any property damaged during the incident as well? If so, could you let me know what was damaged?"", 'Okay, thanks for letting me know. About how many people were involved in the incident altogether?', 'I see. Do you mind telling me when this all took place? Also, what type of safety incident are you reporting, like a workplace injury, fire, or hazardous spill?', 'Were there any other witnesses to what happened? And could you also provide the specific location where the incident took place?', 'Thanks for providing that information. On a scale of minor, moderate, or severe, how would you classify the seriousness of the incident?', ""I'm sorry to hear that. What initial actions did you take after the incident occurred? Also, could you please provide me with your contact details like your name, email, and phone number?"", 'Just one more thing, do you mind sharing around what time the incident occurred? And are there any other notes or observations you want to include?']","['I sprained my ankle.', 'There was no property damage.', 'Just one person was affected, me.', 'The incident occurred on February 15th, 2023 and it was a workplace injury.', 'John Smith witnessed it, and it occurred on the office floor 2.', 'I would say it was moderate.', 'First aid was administered. My name is Priya Singh, my email is priya.dev@techcorp.com.', 'It happened at 10:30 AM. There are no additional notes.']","{'injuries_sustained': 'sprained my ankle', 'property_damage': 'no', 'affected_individuals': 'one', 'incident_date': 'February 15th, 2023', 'incident_type': 'workplace injury', 'witnesses': 'John Smith', 'incident_location': 'office floor 2', 'severity_of_incident': 'moderate', 'immediate_actions_taken': 'First aid was administered', 'reporter_contact_info': 'Priya Singh', 'incident_time': '10:30 AM', 'additional_notes': 'no additional notes'}"
safety_incident_report,"[0, 1, 0, 1, 0, 1, 0, 1, 0, 1, 0, 1, 0, 1, 0, 1]","['HR Assistant: Okay, no problem. What happened? Was it a minor thing or more serious?', 'Employee: It was a moderate incident. I slipped and fell on February 15th, 2023.  ', 'HR Assistant: Got it. Do you remember about what time it happened?', 'Employee: It occurred at 10:00 AM.', 'HR Assistant: Thanks. Can you tell me a bit about what happened? Was it a workplace injury, fire, hazardous spill or something else?', 'Employee: It was a workplace injury.', 'HR Assistant: I see. Were you the only one involved or were others affected too?', 'Employee: Only I was affected. ', ""HR Assistant: Oh no, I'm sorry to hear that. Did you get hurt at all? If so, can you explain what happened?"", 'Employee: Yes, I sprained my ankle.', 'HR Assistant: Okay, thanks for letting me know. After the fall, what did you do right away and where did this all take place?', 'Employee: I received first aid treatment in the office.', 'HR Assistant: Alright, was anything damaged because of the incident? Also, was anyone a witness to what happened?', 'Employee: There was no property damage and no witnesses.', 'HR Assistant: Got it. Is there anything else you think would be helpful for me to know? And can I get your contact info like your name, email and phone number?', 'Employee: There are no additional notes. My name is Alex Jordan, my email is alexartistry@gmail.com, and my phone number is 555-1234.']","[{'severity_of_incident': 'moderate', 'incident_date': 'February 15th, 2023'}, {'incident_time': '10:00 AM'}, {'incident_type': 'workplace injury'}, {'affected_individuals': 'Only I was affected'}, {'injuries_sustained': 'sprained my ankle'}, {'immediate_actions_taken': 'first aid treatment', 'incident_location': 'in the office'}, {'property_damage': 'no witnesses', 'witnesses': 'no witnesses'}, {'additional_notes': 'no additional notes', 'reporter_contact_info': '555-1234'}]","['Okay, no problem. What happened? Was it a minor thing or more serious?', 'Got it. Do you remember about what time it happened?', 'Thanks. Can you tell me a bit about what happened? Was it a workplace injury, fire, hazardous spill or something else?', 'I see. Were you the only one involved or were others affected too?', ""Oh no, I'm sorry to hear that. Did you get hurt at all? If so, can you explain what happened?"", 'Okay, thanks for letting me know. After the fall, what did you do right away and where did this all take place?', 'Alright, was anything damaged because of the incident? Also, was anyone a witness to what happened?', 'Got it. Is there anything else you think would be helpful for me to know? And can I get your contact info like your name, email and phone number?']","['It was a moderate incident. I slipped and fell on February 15th, 2023.', 'It occurred at 10:00 AM.', 'It was a workplace injury.', 'Only I was affected.', 'Yes, I sprained my ankle.', 'I received first aid treatment in the office.', 'There was no property damage and no witnesses.', 'There are no additional notes. My name is Alex Jordan, my email is alexartistry@gmail.com, and my phone number is 555-1234.']","{'severity_of_incident': 'moderate', 'incident_date': 'February 15th, 2023', 'incident_time': '10:00 AM', 'incident_type': 'workplace injury', 'affected_individuals': 'Only I was affected', 'injuries_sustained': 'sprained my ankle', 'immediate_actions_taken': 'first aid treatment', 'incident_location': 'in the office', 'property_damage': 'no witnesses', 'witnesses': 'no witnesses', 'additional_notes': 'no additional notes', 'reporter_contact_info': '555-1234'}"
safety_incident_report,"[0, 1, 0, 1, 0, 1, 0, 1, 0, 1, 0, 1, 0, 1, 0, 1]","[""HR Assistant: No problem, I'm here to help. Can you tell me if there were any other observations or details you think might be useful to include? Also, what time did it happen?"", 'Employee: We could really use some new floor mats in the office. The incident occurred at 2:30pm.', 'HR Assistant: Thanks for sharing that. Could I also get your contact info in case I need to follow up? Your name, email and phone number please.  ', 'Employee: My name is Sofia Alvarez, my email is salvarez@lawfirm.com.', 'HR Assistant: Were there any witnesses? And when did this take place exactly?', 'Employee: There was no one else there to see it, and it happened on February 15th, 2023.', 'HR Assistant: I appreciate you providing those details. What initial steps were taken right after the incident occurred?', 'Employee: First aid was administered.', 'HR Assistant: Do you mind if I ask how many people were affected? And where exactly did it happen in the office?', 'Employee: Only myself, and it occurred in our office space.', 'HR Assistant: Was any property damaged?', 'Employee: No property was damaged. ', 'HR Assistant: One last question - what type of safety incident are we talking about here? And were there any injuries?', 'Employee: It was a workplace injury, I sprained my ankle.', 'HR Assistant: Okay, last question - would you say the incident was minor, moderate or severe?', 'Employee: The incident was moderate.']","[{'additional_notes': 'We could really use some new floor mats in the office', 'incident_time': '2:30pm'}, {'reporter_contact_info': 'Sofia Alvarez'}, {'witnesses': 'no one else there to see it', 'incident_date': 'February 15th, 2023'}, {'immediate_actions_taken': 'First aid'}, {'affected_individuals': 'Only myself', 'incident_location': 'our office space'}, {'property_damage': 'No'}, {'incident_type': 'workplace injury', 'injuries_sustained': 'sprained my ankle'}, {'severity_of_incident': 'moderate'}]","[""No problem, I'm here to help. Can you tell me if there were any other observations or details you think might be useful to include? Also, what time did it happen?"", 'Thanks for sharing that. Could I also get your contact info in case I need to follow up? Your name, email and phone number please.', 'Were there any witnesses? And when did this take place exactly?', 'I appreciate you providing those details. What initial steps were taken right after the incident occurred?', 'Do you mind if I ask how many people were affected? And where exactly did it happen in the office?', 'Was any property damaged?', 'One last question - what type of safety incident are we talking about here? And were there any injuries?', 'Okay, last question - would you say the incident was minor, moderate or severe?']","['We could really use some new floor mats in the office. The incident occurred at 2:30pm.', 'My name is Sofia Alvarez, my email is salvarez@lawfirm.com.', 'There was no one else there to see it, and it happened on February 15th, 2023.', 'First aid was administered.', 'Only myself, and it occurred in our office space.', 'No property was damaged.', 'It was a workplace injury, I sprained my ankle.', 'The incident was moderate.']","{'additional_notes': 'We could really use some new floor mats in the office', 'incident_time': '2:30pm', 'reporter_contact_info': 'Sofia Alvarez', 'witnesses': 'no one else there to see it', 'incident_date': 'February 15th, 2023', 'immediate_actions_taken': 'First aid', 'affected_individuals': 'Only myself', 'incident_location': 'our office space', 'property_damage': 'No', 'incident_type': 'workplace injury', 'injuries_sustained': 'sprained my ankle', 'severity_of_incident': 'moderate'}"
safety_incident_report,"[0, 1, 0, 1, 0, 1, 0, 1, 0, 1, 0, 1, 0, 1, 0, 1]","['HR Assistant: No problem, what happened to cause the incident? Was it an injury, fire or hazardous spill?  ', 'Employee: It was a workplace injury.', ""HR Assistant: Ouch, I'm sorry to hear that. Do you mind telling me about the injury and how you're feeling?  "", 'Employee: I sprained my ankle.', 'HR Assistant: That must have been painful. On a scale of minor to severe, how would you rate the incident? Is there anything else you want to point out?', 'Employee: I would rate it as moderate. I think we need better floor mats in the area.  ', 'HR Assistant: Good call on the mats. What did you do right after it happened? Can you also give me your name, email and phone number?', 'Employee: I provided first aid. My name is Li Wei, my email is liwei@medicalemail.com.', 'HR Assistant: Got it, thanks Li Wei. Were there any other witnesses around when it took place?', 'Employee: No, there were no other witnesses.', 'HR Assistant: No problem. When exactly did this incident occur? Where was the location?', 'Employee: The incident occurred on February 15th, 2023 in hospital room.  ', 'HR Assistant: Almost done. How many people were affected by the incident? Was any property damaged?', 'Employee: Just one person was affected, me. There was no property damage.', 'HR Assistant: Last question - do you remember what time it happened?', 'Employee: It happened at 2:30pm.']","[{'incident_type': 'workplace injury'}, {'injuries_sustained': 'sprained my ankle'}, {'severity_of_incident': 'moderate', 'additional_notes': 'I think we need better floor mats in the area'}, {'immediate_actions_taken': 'provided first aid', 'reporter_contact_info': 'Li Wei, my email is liwei@medicalemail.com'}, {'witnesses': 'No, there were no other witnesses'}, {'incident_date': 'February 15th, 2023', 'incident_location': 'hospital room'}, {'affected_individuals': 'one', 'property_damage': 'no'}, {'incident_time': '2:30pm'}]","['No problem, what happened to cause the incident? Was it an injury, fire or hazardous spill?', ""Ouch, I'm sorry to hear that. Do you mind telling me about the injury and how you're feeling?"", 'That must have been painful. On a scale of minor to severe, how would you rate the incident? Is there anything else you want to point out?', 'Good call on the mats. What did you do right after it happened? Can you also give me your name, email and phone number?', 'Got it, thanks Li Wei. Were there any other witnesses around when it took place?', 'No problem. When exactly did this incident occur? Where was the location?', 'Almost done. How many people were affected by the incident? Was any property damaged?', 'Last question - do you remember what time it happened?']","['It was a workplace injury.', 'I sprained my ankle.', 'I would rate it as moderate. I think we need better floor mats in the area.', 'I provided first aid. My name is Li Wei, my email is liwei@medicalemail.com.', 'No, there were no other witnesses.', 'The incident occurred on February 15th, 2023 in hospital room.', 'Just one person was affected, me. There was no property damage.', 'It happened at 2:30pm.']","{'incident_type': 'workplace injury', 'injuries_sustained': 'sprained my ankle', 'severity_of_incident': 'moderate', 'additional_notes': 'I think we need better floor mats in the area', 'immediate_actions_taken': 'provided first aid', 'reporter_contact_info': 'Li Wei, my email is liwei@medicalemail.com', 'witnesses': 'No, there were no other witnesses', 'incident_date': 'February 15th, 2023', 'incident_location': 'hospital room', 'affected_individuals': 'one', 'property_damage': 'no', 'incident_time': '2:30pm'}"
safety_incident_report,"[0, 1, 0, 1, 0, 1, 0, 1, 0, 1, 0, 1, 0, 1, 0, 1]","[""HR Assistant: No problem, let's see what we can do. Can you give me your name, email and phone number so I have your contact details?"", 'Employee: Sure, my name is Amir Khaled and my contact number is 555-0345.', 'HR Assistant: Thanks Amir. Were there by any chance other people around when this happened? Or were you by yourself at the time?', 'Employee: No, I was by myself when it occurred.  ', 'HR Assistant: Got it. Would you say it was a minor thing, more serious or really bad? Is there anything else you think I should know about what happened?', ""Employee: I'd say it was more serious. We could also use some better knives in the kitchen."", 'HR Assistant: Okay, when did this all go down then? What time of day was it?', 'Employee: The incident happened at 11:30.', 'HR Assistant: Did you suffer any injuries? Was there any property damaged?', 'Employee: I cut my hand but nothing else was damaged.', ""HR Assistant: Could you let me know what exactly I'm making a report about - like a workplace accident, fire, hazardous spill or something else? And where did it take place?"", 'Employee: It was a workplace injury that occurred in the kitchen.  ', 'HR Assistant: Last couple questions - when did this actually happen? And was it just you affected or were others involved too?', 'Employee: It happened on February 15th, 2023 and only I was affected.', 'HR Assistant: Got it. What immediate actions did you take after the incident occurred?', 'Employee: I administered first aid.']","[{'reporter_contact_info': '555-0345'}, {'witnesses': 'No, I was by myself'}, {'severity_of_incident': 'serious', 'additional_notes': 'We could also use some better knives in the kitchen'}, {'incident_time': '11:30'}, {'injuries_sustained': 'I cut my hand', 'property_damage': 'I cut my hand'}, {'incident_type': 'workplace injury', 'incident_location': 'kitchen'}, {'incident_date': 'February 15th, 2023', 'affected_individuals': 'only I was affected'}, {'immediate_actions_taken': 'first aid'}]","[""No problem, let's see what we can do. Can you give me your name, email and phone number so I have your contact details?"", 'Thanks Amir. Were there by any chance other people around when this happened? Or were you by yourself at the time?', 'Got it. Would you say it was a minor thing, more serious or really bad? Is there anything else you think I should know about what happened?', 'Okay, when did this all go down then? What time of day was it?', 'Did you suffer any injuries? Was there any property damaged?', ""Could you let me know what exactly I'm making a report about - like a workplace accident, fire, hazardous spill or something else? And where did it take place?"", 'Last couple questions - when did this actually happen? And was it just you affected or were others involved too?', 'Got it. What immediate actions did you take after the incident occurred?']","['Sure, my name is Amir Khaled and my contact number is 555-0345.', 'No, I was by myself when it occurred.', ""I'd say it was more serious. We could also use some better knives in the kitchen."", 'The incident happened at 11:30.', 'I cut my hand but nothing else was damaged.', 'It was a workplace injury that occurred in the kitchen.', 'It happened on February 15th, 2023 and only I was affected.', 'I administered first aid.']","{'reporter_contact_info': '555-0345', 'witnesses': 'No, I was by myself', 'severity_of_incident': 'serious', 'additional_notes': 'We could also use some better knives in the kitchen', 'incident_time': '11:30', 'injuries_sustained': 'I cut my hand', 'property_damage': 'I cut my hand', 'incident_type': 'workplace injury', 'incident_location': 'kitchen', 'incident_date': 'February 15th, 2023', 'affected_individuals': 'only I was affected', 'immediate_actions_taken': 'first aid'}"
safety_incident_report,"[0, 1, 0, 1, 0, 1, 0, 1, 0, 1, 0, 1, 0, 1, 0, 1]","['HR Assistant: No problem, was any property damaged during the incident? If so, could you tell me a little about it?', 'Employee: No, there was no property damage.', 'HR Assistant: Okay, thanks for letting me know. Where did the incident actually take place? Do you mind sharing the specific location with me?  ', 'Employee: The incident occurred in office room 305.', 'HR Assistant: Got it, thanks. What immediate steps were you able to take after it happened? Do you happen to remember around what time it occurred?', 'Employee: First aid was administered, and the incident took place at 10:30 AM.  ', 'HR Assistant: Thanks for sharing. Could I please get your contact info like your name, email and phone number? About how many people were affected by the incident?', 'Employee: My name is Priya Singh, my email is priya.dev@techcorp.com, and my phone number is 1. ', 'HR Assistant: No problem. On a scale of minor, moderate or severe, how would you classify the level of this incident?', 'Employee: I would say it was moderate.', 'HR Assistant: Okay, thanks for providing that context. Is there anything else you think would be important for me to know about what happened? Any other notes or observations you have?', 'Employee: We may need better floor mats.', 'HR Assistant: Got it, thank you for sharing that suggestion. Lastly, do you remember what date this occurred? Were there any injuries as a result of the incident?', 'Employee: The incident took place on February 15th, 2023. I sprained my ankle. ', 'HR Assistant: Thank you for all the details. Just to confirm, what type of safety incident are you reporting - like a workplace injury, fire, hazardous spill, etc.? Also, were there any witnesses present?', 'Employee: I am reporting a workplace injury. John Smith witnessed the incident.']","[{'property_damage': 'No'}, {'incident_location': 'office room 305'}, {'immediate_actions_taken': 'First aid was administered', 'incident_time': '10:30 AM'}, {'reporter_contact_info': '1', 'affected_individuals': '1'}, {'severity_of_incident': 'moderate'}, {'additional_notes': 'We may need better floor mats'}, {'incident_date': 'February 15th, 2023', 'injuries_sustained': 'sprained my ankle'}, {'incident_type': 'workplace injury', 'witnesses': 'John Smith'}]","['No problem, was any property damaged during the incident? If so, could you tell me a little about it?', 'Okay, thanks for letting me know. Where did the incident actually take place? Do you mind sharing the specific location with me?', 'Got it, thanks. What immediate steps were you able to take after it happened? Do you happen to remember around what time it occurred?', 'Thanks for sharing. Could I please get your contact info like your name, email and phone number? About how many people were affected by the incident?', 'No problem. On a scale of minor, moderate or severe, how would you classify the level of this incident?', 'Okay, thanks for providing that context. Is there anything else you think would be important for me to know about what happened? Any other notes or observations you have?', 'Got it, thank you for sharing that suggestion. Lastly, do you remember what date this occurred? Were there any injuries as a result of the incident?', 'Thank you for all the details. Just to confirm, what type of safety incident are you reporting - like a workplace injury, fire, hazardous spill, etc.? Also, were there any witnesses present?']","['No, there was no property damage.', 'The incident occurred in office room 305.', 'First aid was administered, and the incident took place at 10:30 AM.', 'My name is Priya Singh, my email is priya.dev@techcorp.com, and my phone number is 1.', 'I would say it was moderate.', 'We may need better floor mats.', 'The incident took place on February 15th, 2023. I sprained my ankle.', 'I am reporting a workplace injury. John Smith witnessed the incident.']","{'property_damage': 'No', 'incident_location': 'office room 305', 'immediate_actions_taken': 'First aid was administered', 'incident_time': '10:30 AM', 'reporter_contact_info': '1', 'affected_individuals': '1', 'severity_of_incident': 'moderate', 'additional_notes': 'We may need better floor mats', 'incident_date': 'February 15th, 2023', 'injuries_sustained': 'sprained my ankle', 'incident_type': 'workplace injury', 'witnesses': 'John Smith'}"
