service,speaker,utterance,state,HR_message,Employee_message,entities
performance_review,"[0, 1, 0, 1, 0, 1, 0, 1, 0, 1, 0, 1, 0, 1]","[""HR Assistant: Okay, no problem. How would you describe Sofia's level of collaboration on team projects? And feel free to rate it on a scale of 1 to 5."", ""Employee: I would rate Sofia's level of collaboration as a 5. She was very collaborative on all of our team projects."", ""HR Assistant: That's great to hear. Could you tell me a bit about any new skills or areas of growth Sofia has shown over the past year? And what would you say is her overall performance rating? Again, feel free to use the 1 to 5 scale.  "", 'Employee: Sofia developed strong leadership skills over the past year. Her overall performance has been excellent, I would rate it a 5.', 'HR Assistant: Wonderful. What kind of goals do you think Sofia should focus on for the next review period? And how well do you feel she achieved the goals that were set for her this time?', 'Employee: I think Sofia should focus on growing our client base for the next review period. She fully achieved all the goals that were set for her this time.', 'HR Assistant: Thanks for the feedback. In your opinion, are there any areas Sofia could improve in? And does she need any additional training?', 'Employee: I think time management is an area Sofia could improve. She may also benefit from some contract negotiation training.', 'HR Assistant: Got it, thanks for the input. Just to confirm, who is this performance review for?', 'Employee: This performance review is for Sofia Alvarez.  ', ""HR Assistant: Great, and what is the time period being covered and what is Sofia's role?"", ""Employee: This review covers the past year, from 2020-01-01 to 2021-01-01. Sofia's role is a lawyer."", ""HR Assistant: One last thing - are there any leadership qualities you've noticed Sofia exhibiting?"", 'Employee: Sofia has shown herself to be a very strategic thinker.']","[{'team_contribution': '5'}, {'skill_development': 'leadership skills', 'overall_performance_rating': 'excellent'}, {'next_review_goals': 'growing our client base', 'goal_achievement': 'fully'}, {'areas_for_improvement': 'time management', 'additional_training_needed': 'contract negotiation'}, {'employee_name': 'Sofia Alvarez'}, {'review_period': '2020-01-01 to 2021-01-01', 'job_role': 'lawyer'}, {'leadership_qualities': 'strategic thinker'}]","[""Okay, no problem. How would you describe Sofia's level of collaboration on team projects? And feel free to rate it on a scale of 1 to 5."", ""That's great to hear. Could you tell me a bit about any new skills or areas of growth Sofia has shown over the past year? And what would you say is her overall performance rating? Again, feel free to use the 1 to 5 scale."", 'Wonderful. What kind of goals do you think Sofia should focus on for the next review period? And how well do you feel she achieved the goals that were set for her this time?', 'Thanks for the feedback. In your opinion, are there any areas Sofia could improve in? And does she need any additional training?', 'Got it, thanks for the input. Just to confirm, who is this performance review for?', ""Great, and what is the time period being covered and what is Sofia's role?"", ""One last thing - are there any leadership qualities you've noticed Sofia exhibiting?""]","[""I would rate Sofia's level of collaboration as a 5. She was very collaborative on all of our team projects."", 'Sofia developed strong leadership skills over the past year. Her overall performance has been excellent, I would rate it a 5.', 'I think Sofia should focus on growing our client base for the next review period. She fully achieved all the goals that were set for her this time.', 'I think time management is an area Sofia could improve. She may also benefit from some contract negotiation training.', 'This performance review is for Sofia Alvarez.', ""This review covers the past year, from 2020-01-01 to 2021-01-01. Sofia's role is a lawyer."", 'Sofia has shown herself to be a very strategic thinker.']","{'team_contribution': '5', 'skill_development': 'leadership skills', 'overall_performance_rating': 'excellent', 'next_review_goals': 'growing our client base', 'goal_achievement': 'fully', 'areas_for_improvement': 'time management', 'additional_training_needed': 'contract negotiation', 'employee_name': 'Sofia Alvarez', 'review_period': '2020-01-01 to 2021-01-01', 'job_role': 'lawyer', 'leadership_qualities': 'strategic thinker'}"
performance_review,"[0, 1, 0, 1, 0, 1, 0, 1, 0, 1, 0, 1, 0, 1]","['HR Assistant: No problem, what areas do you think Henry could improve on for the next year? Also, what new skills has he picked up lately?', ""Employee: Henry could work on managing his time better. He's gotten better at researching new topics."", ""HR Assistant: Okay, great. What's Henry's full name by the way?"", 'Employee: Henry Kim.', 'HR Assistant: Thanks. On a scale of 1 to 5, how well would you say Henry achieved the goals that were set for him last year? And how well do you feel he contributed to team projects?  ', ""Employee: I'd say Henry fully met all the goals that were set. He's also very good at collaborating with others on projects."", ""HR Assistant: That's good to hear. So on a scale of 1 to 5, what overall performance rating would you give Henry?"", 'Employee: A 5.', 'HR Assistant: Wonderful. Do you think Henry needs any additional training to help him in his role?', ""Employee: No, I don't think Henry needs any more training."", 'HR Assistant: Got it. What job does Henry have and what leadership qualities, if any, do you see in him?', 'Employee: Henry is a scientist who helps train and guide the other junior scientists.', 'HR Assistant: Almost done! What time period was this review for and what new goals should Henry focus on achieving in the coming year?', 'Employee: This review was for the past year. His new goals should be publishing some research papers.']","[{'areas_for_improvement': 'managing his time better', 'skill_development': ""He's gotten better at researching new topics""}, {'employee_name': 'Henry Kim'}, {'goal_achievement': 'fully', 'team_contribution': 'very good'}, {'overall_performance_rating': 'A 5'}, {'additional_training_needed': ""No, I don't think Henry needs any more training""}, {'job_role': 'scientist', 'leadership_qualities': 'helps train and guide the other junior scientists'}, {'review_period': 'the past year', 'next_review_goals': 'publishing some research papers'}]","['No problem, what areas do you think Henry could improve on for the next year? Also, what new skills has he picked up lately?', ""Okay, great. What's Henry's full name by the way?"", 'Thanks. On a scale of 1 to 5, how well would you say Henry achieved the goals that were set for him last year? And how well do you feel he contributed to team projects?', ""That's good to hear. So on a scale of 1 to 5, what overall performance rating would you give Henry?"", 'Wonderful. Do you think Henry needs any additional training to help him in his role?', 'Got it. What job does Henry have and what leadership qualities, if any, do you see in him?', 'Almost done! What time period was this review for and what new goals should Henry focus on achieving in the coming year?']","[""Henry could work on managing his time better. He's gotten better at researching new topics."", 'Henry Kim.', ""I'd say Henry fully met all the goals that were set. He's also very good at collaborating with others on projects."", 'A 5.', ""No, I don't think Henry needs any more training."", 'Henry is a scientist who helps train and guide the other junior scientists.', 'This review was for the past year. His new goals should be publishing some research papers.']","{'areas_for_improvement': 'managing his time better', 'skill_development': ""He's gotten better at researching new topics"", 'employee_name': 'Henry Kim', 'goal_achievement': 'fully', 'team_contribution': 'very good', 'overall_performance_rating': 'A 5', 'additional_training_needed': ""No, I don't think Henry needs any more training"", 'job_role': 'scientist', 'leadership_qualities': 'helps train and guide the other junior scientists', 'review_period': 'the past year', 'next_review_goals': 'publishing some research papers'}"
performance_review,"[0, 1, 0, 1, 0, 1, 0, 1, 0, 1, 0, 1]","['HR Assistant: No problem. What time period are we looking at, and can you tell me a bit about how your skills have developed in that time?', 'Employee: The review period is from 2021 to 2022. During that time, I learned some new research skills that have helped me in my work.', ""HR Assistant: That's great to hear that you expanded your skills. On a scale of 1 to 5, with 5 being the highest, how would you rate your overall performance? Do you feel you need any additional training moving forward?  "", ""Employee: I would rate my performance as a 5. I don't think I need any additional training at this time."", 'HR Assistant: Excellent work. What is your job role here and how well were you able to achieve the goals that were set for you last review period?', 'Employee: My role is as a scientist. I believe I fully achieved all of the goals that were set for me.', ""HR Assistant: That's wonderful to hear. What kinds of goals would you like to focus on for the next review period? Also on a 1 to 5 scale, how would you rate your contributions to any team projects?"", 'Employee: For the next review period, I aim to publish two papers. I would rate my contributions to team projects as a 5, as I try to be very collaborative.', 'HR Assistant: Great, thanks for sharing. Lastly, what is your name so I have it correctly in the review?  ', 'Employee: My name is Henry Kim.', ""HR Assistant: Henry, before we wrap up, please tell me about any leadership qualities you've shown and if there are any areas you think could use some improvement going forward."", 'Employee: I try to mentor some of the junior scientists. One area that could use improvement is managing my time more efficiently.']","[{'review_period': '2021 to 2022', 'skill_development': 'research skills'}, {'overall_performance_rating': '5', 'additional_training_needed': ""I don't""}, {'job_role': 'scientist', 'goal_achievement': 'fully'}, {'next_review_goals': 'publish two papers', 'team_contribution': '5'}, {'employee_name': 'Henry Kim'}, {'leadership_qualities': 'I try to mentor some of the junior scientists', 'areas_for_improvement': 'managing my time more efficiently'}]","['No problem. What time period are we looking at, and can you tell me a bit about how your skills have developed in that time?', ""That's great to hear that you expanded your skills. On a scale of 1 to 5, with 5 being the highest, how would you rate your overall performance? Do you feel you need any additional training moving forward?"", 'Excellent work. What is your job role here and how well were you able to achieve the goals that were set for you last review period?', ""That's wonderful to hear. What kinds of goals would you like to focus on for the next review period? Also on a 1 to 5 scale, how would you rate your contributions to any team projects?"", 'Great, thanks for sharing. Lastly, what is your name so I have it correctly in the review?', ""Henry, before we wrap up, please tell me about any leadership qualities you've shown and if there are any areas you think could use some improvement going forward.""]","['The review period is from 2021 to 2022. During that time, I learned some new research skills that have helped me in my work.', ""I would rate my performance as a 5. I don't think I need any additional training at this time."", 'My role is as a scientist. I believe I fully achieved all of the goals that were set for me.', 'For the next review period, I aim to publish two papers. I would rate my contributions to team projects as a 5, as I try to be very collaborative.', 'My name is Henry Kim.', 'I try to mentor some of the junior scientists. One area that could use improvement is managing my time more efficiently.']","{'review_period': '2021 to 2022', 'skill_development': 'research skills', 'overall_performance_rating': '5', 'additional_training_needed': ""I don't"", 'job_role': 'scientist', 'goal_achievement': 'fully', 'next_review_goals': 'publish two papers', 'team_contribution': '5', 'employee_name': 'Henry Kim', 'leadership_qualities': 'I try to mentor some of the junior scientists', 'areas_for_improvement': 'managing my time more efficiently'}"
performance_review,"[0, 1, 0, 1, 0, 1, 0, 1, 0, 1, 0, 1, 0, 1, 0, 1]","['HR Assistant: Okay, no problem. How well do you think Henry achieved the goals that were set for him over the past year? On a scale of 1 to 5, with 5 being very well.', ""Employee: I'd say Henry achieved his goals at about a 4. "", ""HR Assistant: Great, that's good to hear. Now overall, how would you rate Henry's performance in his role as a Scientist? Again on a scale of 1 to 5."", ""Employee: Henry's overall performance has been about a 4."", ""HR Assistant: Thanks. Does Henry need any additional training to help improve or develop further in his role? Also, what is Henry's name and job role?  "", 'Employee: Henry could benefit from some leadership training. The employee being reviewed is Henry Kim and his job role is Scientist.', ""HR Assistant: Got it, thanks. How would you describe Henry's contribution to any team projects over the past year? Also, what goals do you think would be good to set for Henry over the next review period?"", 'Employee: Henry contributed at a 5 to any team projects. Some good goals for the next review period would be for Henry to publish some research papers.', 'HR Assistant: Perfect. Lastly, can you provide the time period that this review covers? Just the dates in YYYY-MM-DD format will do.', 'Employee: This review is for the past year.', 'HR Assistant: Thanks. What leadership qualities, if any, have you seen Henry exhibit over the past year?', 'Employee: Henry has shown that he is able to mentor some of the junior scientists.  ', ""HR Assistant: That's great to hear. Has Henry shown any new skills he's developed or areas of learning growth over the past year?"", 'Employee: Henry has learned some new skills in his role over the past year.', 'HR Assistant: Finally, are there any areas you think Henry could improve in or develop further? ', 'Employee: One area Henry could work on is his time management.']","[{'goal_achievement': '4'}, {'overall_performance_rating': '4'}, {'additional_training_needed': 'leadership', 'employee_name': 'Henry Kim'}, {'team_contribution': '5', 'next_review_goals': 'for Henry to publish some research papers'}, {'review_period': 'the past year'}, {'leadership_qualities': 'Henry has shown that he is able to mentor some of the junior scientists'}, {'skill_development': 'learned some new skills'}, {'areas_for_improvement': 'time management', 'job_role': 'One area Henry could work on is his time management'}]","['Okay, no problem. How well do you think Henry achieved the goals that were set for him over the past year? On a scale of 1 to 5, with 5 being very well.', ""Great, that's good to hear. Now overall, how would you rate Henry's performance in his role as a Scientist? Again on a scale of 1 to 5."", ""Thanks. Does Henry need any additional training to help improve or develop further in his role? Also, what is Henry's name and job role?"", ""Got it, thanks. How would you describe Henry's contribution to any team projects over the past year? Also, what goals do you think would be good to set for Henry over the next review period?"", 'Perfect. Lastly, can you provide the time period that this review covers? Just the dates in YYYY-MM-DD format will do.', 'Thanks. What leadership qualities, if any, have you seen Henry exhibit over the past year?', ""That's great to hear. Has Henry shown any new skills he's developed or areas of learning growth over the past year?"", 'Finally, are there any areas you think Henry could improve in or develop further?']","[""I'd say Henry achieved his goals at about a 4."", ""Henry's overall performance has been about a 4."", 'Henry could benefit from some leadership training. The employee being reviewed is Henry Kim and his job role is Scientist.', 'Henry contributed at a 5 to any team projects. Some good goals for the next review period would be for Henry to publish some research papers.', 'This review is for the past year.', 'Henry has shown that he is able to mentor some of the junior scientists.', 'Henry has learned some new skills in his role over the past year.', 'One area Henry could work on is his time management.']","{'goal_achievement': '4', 'overall_performance_rating': '4', 'additional_training_needed': 'leadership', 'employee_name': 'Henry Kim', 'team_contribution': '5', 'next_review_goals': 'for Henry to publish some research papers', 'review_period': 'the past year', 'leadership_qualities': 'Henry has shown that he is able to mentor some of the junior scientists', 'skill_development': 'learned some new skills', 'areas_for_improvement': 'time management', 'job_role': 'One area Henry could work on is his time management'}"
performance_review,"[0, 1, 0, 1, 0, 1, 0, 1, 0, 1, 0, 1]","[""HR Assistant: No problem, what's the overall rating for this review? And what area do you think they could improve in?"", 'Employee: The overall rating is 5 out of 5. One area for improvement is their time management skills.', 'HR Assistant: Got it. What period of time does this review cover? And how would you rate their contributions to team projects?  ', ""Employee: This review covers the past 12 months. I'd rate their contributions to team projects as a 5 out of 5."", ""HR Assistant: Okay, great. What's the name of the employee being reviewed? And in your opinion, how well did they achieve their set goals?"", ""Employee: The employee's name is Carlos Mendez. I'd say he achieved his goals at a 4 out of 5."", ""HR Assistant: Thanks for that info. What is Carlos' job role? Also, did you notice any leadership qualities from him?"", 'Employee: Carlos is an Engineer. He mentored some of the junior engineers on our team.', ""HR Assistant: Almost done. What goals do you think should be set for Carlos' next review period? Also, is there any additional training that may help him out?"", 'Employee: For his next review, he should lead one of our project teams. Some leadership training could be beneficial.', 'HR Assistant: Great, thanks for walking me through this. Last question - what skills has Carlos developed or grown in during this review period?', 'Employee: Carlos has learned some new technical skills over the past year.']","[{'overall_performance_rating': '5 out of 5', 'areas_for_improvement': 'time management skills'}, {'review_period': 'the past 12 months', 'team_contribution': '5 out of 5'}, {'employee_name': 'Carlos Mendez', 'goal_achievement': '4'}, {'job_role': 'Engineer', 'leadership_qualities': 'He mentored some of the junior engineers on our team'}, {'next_review_goals': 'he should lead one of our project teams', 'additional_training_needed': 'leadership'}, {'skill_development': 'technical skills'}]","[""No problem, what's the overall rating for this review? And what area do you think they could improve in?"", 'Got it. What period of time does this review cover? And how would you rate their contributions to team projects?', ""Okay, great. What's the name of the employee being reviewed? And in your opinion, how well did they achieve their set goals?"", ""Thanks for that info. What is Carlos' job role? Also, did you notice any leadership qualities from him?"", ""Almost done. What goals do you think should be set for Carlos' next review period? Also, is there any additional training that may help him out?"", 'Great, thanks for walking me through this. Last question - what skills has Carlos developed or grown in during this review period?']","['The overall rating is 5 out of 5. One area for improvement is their time management skills.', ""This review covers the past 12 months. I'd rate their contributions to team projects as a 5 out of 5."", ""The employee's name is Carlos Mendez. I'd say he achieved his goals at a 4 out of 5."", 'Carlos is an Engineer. He mentored some of the junior engineers on our team.', 'For his next review, he should lead one of our project teams. Some leadership training could be beneficial.', 'Carlos has learned some new technical skills over the past year.']","{'overall_performance_rating': '5 out of 5', 'areas_for_improvement': 'time management skills', 'review_period': 'the past 12 months', 'team_contribution': '5 out of 5', 'employee_name': 'Carlos Mendez', 'goal_achievement': '4', 'job_role': 'Engineer', 'leadership_qualities': 'He mentored some of the junior engineers on our team', 'next_review_goals': 'he should lead one of our project teams', 'additional_training_needed': 'leadership', 'skill_development': 'technical skills'}"
performance_review,"[0, 1, 0, 1, 0, 1, 0, 1, 0, 1, 0, 1, 0, 1, 0, 1]","['HR Assistant: No problem, tell me about any leadership qualities this employee has shown.', 'Employee: The employee has exhibited independent research skills.  ', 'HR Assistant: Okay, what time period are we reviewing here? If you could give me the dates in year-month-day format that would be great.', ""Employee: We're reviewing January 2022."", 'HR Assistant: Alright, does this employee need any additional training to improve their skills?', 'Employee: No, the employee does not need additional training.', 'HR Assistant: How well did the employee achieve their goals for this period? You can rate them from 1 to 5, with 5 being the best. Also, can you describe how this employee has grown and developed their skills?', 'Employee: The employee achieved their goals at a level of 4. The employee has shown continuous learning.', ""HR Assistant: What is the name of the employee we're reviewing?"", ""Employee: The employee's name is Henry Kim.  "", ""HR Assistant: Okay, what is Henry Kim's job role and are there any areas they could improve in?"", ""Employee: Henry Kim's role is Scientist. An area for improvement is time management."", ""HR Assistant: Great, what goals should be set for Henry Kim's next review period? Also, what would you say is their overall performance rating out of 5?"", ""Employee: The goal for the next period should be to publish research. Henry Kim's overall performance rating is 5."", ""HR Assistant: Last question - how would you rate Henry Kim's contribution to team projects, again on a scale of 1 to 5?"", ""Employee: Henry Kim's contribution to team projects rates a 5.""]","[{'leadership_qualities': 'independent research skills'}, {'review_period': 'January 2022'}, {'additional_training_needed': 'No, the employee does not'}, {'goal_achievement': '4', 'skill_development': 'continuous learning'}, {'employee_name': 'Henry Kim'}, {'job_role': 'Scientist', 'areas_for_improvement': 'time management'}, {'next_review_goals': 'to publish research', 'overall_performance_rating': '5'}, {'team_contribution': '5'}]","['No problem, tell me about any leadership qualities this employee has shown.', 'Okay, what time period are we reviewing here? If you could give me the dates in year-month-day format that would be great.', 'Alright, does this employee need any additional training to improve their skills?', 'How well did the employee achieve their goals for this period? You can rate them from 1 to 5, with 5 being the best. Also, can you describe how this employee has grown and developed their skills?', ""What is the name of the employee we're reviewing?"", ""Okay, what is Henry Kim's job role and are there any areas they could improve in?"", ""Great, what goals should be set for Henry Kim's next review period? Also, what would you say is their overall performance rating out of 5?"", ""Last question - how would you rate Henry Kim's contribution to team projects, again on a scale of 1 to 5?""]","['The employee has exhibited independent research skills.', ""We're reviewing January 2022."", 'No, the employee does not need additional training.', 'The employee achieved their goals at a level of 4. The employee has shown continuous learning.', ""The employee's name is Henry Kim."", ""Henry Kim's role is Scientist. An area for improvement is time management."", ""The goal for the next period should be to publish research. Henry Kim's overall performance rating is 5."", ""Henry Kim's contribution to team projects rates a 5.""]","{'leadership_qualities': 'independent research skills', 'review_period': 'January 2022', 'additional_training_needed': 'No, the employee does not', 'goal_achievement': '4', 'skill_development': 'continuous learning', 'employee_name': 'Henry Kim', 'job_role': 'Scientist', 'areas_for_improvement': 'time management', 'next_review_goals': 'to publish research', 'overall_performance_rating': '5', 'team_contribution': '5'}"
