service,speaker,utterance,state,HR_message,Employee_message,entities
safety_incident_report,"[0, 1, 0, 1, 0, 1, 0, 1, 0, 1, 0, 1, 0, 1]","['HR Assistant: No problem, let me know what happened. Was there anything else you noticed or want to add about the incident? Oh and could you tell me when it happened date-wise?', 'Employee: I think we need better knives in the kitchen. The incident happened on February 15th, 2023.  ', 'HR Assistant: Okay, thanks for letting me know. What did you do right after it happened?', 'Employee: I administered first aid.', ""HR Assistant: I'm sorry to hear that. Were you hurt at all? If so, could you describe your injury for me? Also, do you remember around what time it occurred?"", 'Employee: I cut my hand. It happened at 2:30 pm.', 'HR Assistant: Thanks for providing those details. What type of safety incident are you reporting, like a workplace injury, fire or hazardous spill? Also, how many people were affected by it?', 'Employee: It was a workplace injury and I was the only one affected.', 'HR Assistant: No problem. Could you give me your name, email and phone number so I have your contact details? And would you say the incident was minor, moderate or severe?  ', 'Employee: My name is Amir Khaled, my email is amir.khaled@email.com and my phone number is +1-555-0345. I would say the incident was moderate.', 'HR Assistant: Almost done, just need to know where it took place and if anyone saw what happened. Was it in a specific area and were there any witnesses?', 'Employee: It happened in the kitchen. John Smith witnessed it. ', 'HR Assistant: Okay, just one last question - was any property damaged?', 'Employee: No, there was no property damage.']","[{'additional_notes': 'I think we need better knives in the kitchen', 'incident_date': 'February 15th, 2023'}, {'immediate_actions_taken': 'first aid'}, {'injuries_sustained': 'cut my hand', 'incident_time': '2:30 pm'}, {'incident_type': 'workplace injury', 'affected_individuals': 'I was the only one affected'}, {'reporter_contact_info': 'Amir Khaled', 'severity_of_incident': 'moderate'}, {'incident_location': 'in the kitchen', 'witnesses': 'John Smith witnessed it'}, {'property_damage': 'No'}]","['No problem, let me know what happened. Was there anything else you noticed or want to add about the incident? Oh and could you tell me when it happened date-wise?', 'Okay, thanks for letting me know. What did you do right after it happened?', ""I'm sorry to hear that. Were you hurt at all? If so, could you describe your injury for me? Also, do you remember around what time it occurred?"", 'Thanks for providing those details. What type of safety incident are you reporting, like a workplace injury, fire or hazardous spill? Also, how many people were affected by it?', 'No problem. Could you give me your name, email and phone number so I have your contact details? And would you say the incident was minor, moderate or severe?', 'Almost done, just need to know where it took place and if anyone saw what happened. Was it in a specific area and were there any witnesses?', 'Okay, just one last question - was any property damaged?']","['I think we need better knives in the kitchen. The incident happened on February 15th, 2023.', 'I administered first aid.', 'I cut my hand. It happened at 2:30 pm.', 'It was a workplace injury and I was the only one affected.', 'My name is Amir Khaled, my email is amir.khaled@email.com and my phone number is +1-555-0345. I would say the incident was moderate.', 'It happened in the kitchen. John Smith witnessed it.', 'No, there was no property damage.']","{'additional_notes': 'I think we need better knives in the kitchen', 'incident_date': 'February 15th, 2023', 'immediate_actions_taken': 'first aid', 'injuries_sustained': 'cut my hand', 'incident_time': '2:30 pm', 'incident_type': 'workplace injury', 'affected_individuals': 'I was the only one affected', 'reporter_contact_info': 'Amir Khaled', 'severity_of_incident': 'moderate', 'incident_location': 'in the kitchen', 'witnesses': 'John Smith witnessed it', 'property_damage': 'No'}"
safety_incident_report,"[0, 1, 0, 1, 0, 1, 0, 1, 0, 1, 0, 1, 0, 1, 0, 1]","[""HR Assistant: Oh no, I'm sorry to hear that. Can you tell me a little bit about what happened? Was it a minor incident or something more serious? Did anyone else get involved?"", 'Employee: It was a moderate incident, just involving me.', ""HR Assistant: No problem, let's get the details down. Could you give me your name, email and phone number so I have your contact info?  "", 'Employee: My name is Amir Khaled, my email is amir.khaled@email.com and my phone number is +1-555-0345.', 'HR Assistant: Were there any witnesses around when it happened?', 'Employee: No, I was alone at the time.', 'HR Assistant: Okay, thanks for letting me know. Did you happen to get hurt at all? If so, can you tell me about your injuries and what first aid you received?', 'Employee: I got a cut on my hand and I administered first aid to it.', 'HR Assistant: Alright, when did this all take place? What time of day was it?', 'Employee: It occurred at 11:30.', 'HR Assistant: Can you tell me what exactly was happening? Was it a workplace injury, fire, hazardous spill or something else?', 'Employee: It was a workplace injury. ', 'HR Assistant: And when did this injury happen? Also, is there anything else you think I should know about the incident?', 'Employee: It happened on February 15th, 2023. I think we need better knives in the kitchen to prevent future injuries.', 'HR Assistant: Was any equipment or property damaged? And can you tell me exactly where this took place?', 'Employee: No property was damaged. It occurred in the kitchen.']","[{'severity_of_incident': 'moderate', 'affected_individuals': 'just involving me'}, {'reporter_contact_info': 'Amir Khaled'}, {'witnesses': 'No, I was alone'}, {'injuries_sustained': 'a cut on my hand', 'immediate_actions_taken': 'first aid'}, {'incident_time': '11:30'}, {'incident_type': 'workplace injury'}, {'incident_date': 'February 15th, 2023', 'additional_notes': 'I think we need better knives in the kitchen to prevent future injuries'}, {'property_damage': 'It occurred in the kitchen', 'incident_location': 'the kitchen'}]","[""Oh no, I'm sorry to hear that. Can you tell me a little bit about what happened? Was it a minor incident or something more serious? Did anyone else get involved?"", ""No problem, let's get the details down. Could you give me your name, email and phone number so I have your contact info?"", 'Were there any witnesses around when it happened?', 'Okay, thanks for letting me know. Did you happen to get hurt at all? If so, can you tell me about your injuries and what first aid you received?', 'Alright, when did this all take place? What time of day was it?', 'Can you tell me what exactly was happening? Was it a workplace injury, fire, hazardous spill or something else?', 'And when did this injury happen? Also, is there anything else you think I should know about the incident?', 'Was any equipment or property damaged? And can you tell me exactly where this took place?']","['It was a moderate incident, just involving me.', 'My name is Amir Khaled, my email is amir.khaled@email.com and my phone number is +1-555-0345.', 'No, I was alone at the time.', 'I got a cut on my hand and I administered first aid to it.', 'It occurred at 11:30.', 'It was a workplace injury.', 'It happened on February 15th, 2023. I think we need better knives in the kitchen to prevent future injuries.', 'No property was damaged. It occurred in the kitchen.']","{'severity_of_incident': 'moderate', 'affected_individuals': 'just involving me', 'reporter_contact_info': 'Amir Khaled', 'witnesses': 'No, I was alone', 'injuries_sustained': 'a cut on my hand', 'immediate_actions_taken': 'first aid', 'incident_time': '11:30', 'incident_type': 'workplace injury', 'incident_date': 'February 15th, 2023', 'additional_notes': 'I think we need better knives in the kitchen to prevent future injuries', 'property_damage': 'It occurred in the kitchen', 'incident_location': 'the kitchen'}"
safety_incident_report,"[0, 1, 0, 1, 0, 1, 0, 1, 0, 1, 0, 1]","['HR Assistant: No problem, let me know if you have any other details you want to include or things that were done right after. What happened after you fell?', 'Employee: I administered first aid to myself.', ""HR Assistant: Okay, were you the only one affected? If you don't mind me asking, what time did it happen?  "", 'Employee: Yes, it was just me at 10:00 AM.', 'HR Assistant: Were there any witnesses? Also, was anything damaged when you fell?', 'Employee: No, there was no one else there and nothing was broken.', 'HR Assistant: Could you tell me what type of incident it was so I can fill that part out? Did you hurt yourself at all?', 'Employee: It was a workplace injury. Unfortunately I sprained my ankle.', 'HR Assistant: No worries, I just need your contact info like your name, email and phone number. Do you mind also telling me where exactly it took place?', 'Employee: My name is Alex Jordan, my email is alexartistry@email.com, and it happened in the office.', 'HR Assistant: Almost done, just need the date. Also, how bad was the sprain on a scale of minor to severe?', 'Employee: It happened on February 15th, 2023. The sprain was moderate.']","[{'additional_notes': 'I administered first aid to myself', 'immediate_actions_taken': 'first aid'}, {'affected_individuals': 'it was just me', 'incident_time': '10:00 AM'}, {'witnesses': 'No, there was no one else there and nothing was broken', 'property_damage': 'nothing was broken'}, {'incident_type': 'workplace injury', 'injuries_sustained': 'sprained my ankle'}, {'reporter_contact_info': 'Alex Jordan, my email is alexartistry@email.com', 'incident_location': 'in the office'}, {'incident_date': 'February 15th, 2023', 'severity_of_incident': 'moderate'}]","['No problem, let me know if you have any other details you want to include or things that were done right after. What happened after you fell?', ""Okay, were you the only one affected? If you don't mind me asking, what time did it happen?"", 'Were there any witnesses? Also, was anything damaged when you fell?', 'Could you tell me what type of incident it was so I can fill that part out? Did you hurt yourself at all?', 'No worries, I just need your contact info like your name, email and phone number. Do you mind also telling me where exactly it took place?', 'Almost done, just need the date. Also, how bad was the sprain on a scale of minor to severe?']","['I administered first aid to myself.', 'Yes, it was just me at 10:00 AM.', 'No, there was no one else there and nothing was broken.', 'It was a workplace injury. Unfortunately I sprained my ankle.', 'My name is Alex Jordan, my email is alexartistry@email.com, and it happened in the office.', 'It happened on February 15th, 2023. The sprain was moderate.']","{'additional_notes': 'I administered first aid to myself', 'immediate_actions_taken': 'first aid', 'affected_individuals': 'it was just me', 'incident_time': '10:00 AM', 'witnesses': 'No, there was no one else there and nothing was broken', 'property_damage': 'nothing was broken', 'incident_type': 'workplace injury', 'injuries_sustained': 'sprained my ankle', 'reporter_contact_info': 'Alex Jordan, my email is alexartistry@email.com', 'incident_location': 'in the office', 'incident_date': 'February 15th, 2023', 'severity_of_incident': 'moderate'}"
safety_incident_report,"[0, 1, 0, 1, 0, 1, 0, 1, 0, 1, 0, 1, 0, 1, 0, 1]","[""HR Assistant: No problem, let's take a look. How many people were impacted by what happened?"", 'Employee: One person was affected by the incident.  ', ""HR Assistant: I'm sorry to hear that. Was any property damaged during the incident? If so, can you tell me what happened? Also, do you remember around what time the incident occurred?"", 'Employee: There was no property damage. The incident occurred at around 11:30.', ""HR Assistant: Ouch, I hope everyone is okay. Were there any injuries from the incident? If you don't mind sharing, what type of injury happened?"", 'Employee: There was a cut on my hand.', ""HR Assistant: I'm sorry to hear that. When did the incident actually take place? Were there any other witnesses to what happened?  "", 'Employee: The incident took place on February 15th, 2023 and there were no other witnesses.', 'HR Assistant: Thanks for providing those details. What initial actions did you take after the incident occurred? Also, what category would you say this type of incident falls under?', 'Employee: First aid was administered. This was a workplace injury.', 'HR Assistant: Got it. On a scale of minor to severe, how would you rate the seriousness of the incident?  ', 'Employee: The incident would be considered moderate.', 'HR Assistant: No problem, I just have one last question. Is there anything else you think I should know or that you want to share about what happened? And can you also provide your contact information?', 'Employee: I think we need better knives in the kitchen. My name is Amir Khaled and my contact number is +1-555-0345.', 'HR Assistant: Thank you for providing all those details, Amir. Just one last thing - where did the incident actually take place?', 'Employee: The incident occurred in the kitchen.']","[{'affected_individuals': 'One'}, {'property_damage': 'There was no', 'incident_time': '11:30'}, {'injuries_sustained': 'a cut on my hand'}, {'incident_date': 'February 15th, 2023', 'witnesses': 'no other witnesses'}, {'immediate_actions_taken': 'First aid', 'incident_type': 'workplace injury'}, {'severity_of_incident': 'moderate'}, {'additional_notes': 'I think we need better knives in the kitchen. My name is Amir Khaled', 'reporter_contact_info': '+1-555-0345'}, {'incident_location': 'in the kitchen'}]","[""No problem, let's take a look. How many people were impacted by what happened?"", ""I'm sorry to hear that. Was any property damaged during the incident? If so, can you tell me what happened? Also, do you remember around what time the incident occurred?"", ""Ouch, I hope everyone is okay. Were there any injuries from the incident? If you don't mind sharing, what type of injury happened?"", ""I'm sorry to hear that. When did the incident actually take place? Were there any other witnesses to what happened?"", 'Thanks for providing those details. What initial actions did you take after the incident occurred? Also, what category would you say this type of incident falls under?', 'Got it. On a scale of minor to severe, how would you rate the seriousness of the incident?', 'No problem, I just have one last question. Is there anything else you think I should know or that you want to share about what happened? And can you also provide your contact information?', 'Thank you for providing all those details, Amir. Just one last thing - where did the incident actually take place?']","['One person was affected by the incident.', 'There was no property damage. The incident occurred at around 11:30.', 'There was a cut on my hand.', 'The incident took place on February 15th, 2023 and there were no other witnesses.', 'First aid was administered. This was a workplace injury.', 'The incident would be considered moderate.', 'I think we need better knives in the kitchen. My name is Amir Khaled and my contact number is +1-555-0345.', 'The incident occurred in the kitchen.']","{'affected_individuals': 'One', 'property_damage': 'There was no', 'incident_time': '11:30', 'injuries_sustained': 'a cut on my hand', 'incident_date': 'February 15th, 2023', 'witnesses': 'no other witnesses', 'immediate_actions_taken': 'First aid', 'incident_type': 'workplace injury', 'severity_of_incident': 'moderate', 'additional_notes': 'I think we need better knives in the kitchen. My name is Amir Khaled', 'reporter_contact_info': '+1-555-0345', 'incident_location': 'in the kitchen'}"
safety_incident_report,"[0, 1, 0, 1, 0, 1, 0, 1, 0, 1, 0, 1, 0, 1, 0, 1]","[""HR Assistant: Oh no, I'm sorry to hear that. What happened and are you okay? Did you need any first aid?"", 'Employee: Yes, I cut my hand while using a knife. A coworker helped bandage it up.  ', 'HR Assistant: Glad to hear you got some help. Was there any other damage from the incident? Can you also give me your name and contact details so I have them for the report?', ""Employee: No, there wasn't any other damage. My name is Amir Khaled and my number is +1-555-0345."", 'HR Assistant: Thanks for letting me know. Do you have anything else you want to mention about what happened?  ', 'Employee: I think we could use some sharper knives in the kitchen.', ""HR Assistant: Got it, I'll make a note of that. Was anyone else around when it happened?"", 'Employee: No, I was alone in the kitchen at the time.', 'HR Assistant: Can you tell me where exactly this took place?', 'Employee: It occurred in our company kitchen.', 'HR Assistant: Just need a few more details. How many people were affected by the incident? What was the date it happened?', 'Employee: Only one person was affected, which was me. It occurred on February 15, 2023.', 'HR Assistant: Great, last couple questions - what time did it happen and what type of incident are we reporting?', 'Employee: It happened at 11:30 in the morning. This would be a workplace injury report.', 'HR Assistant: Almost done, just need to know how serious the injury was considered. Was it minor, moderate or severe?', 'Employee: It was considered a moderate injury.']","[{'injuries_sustained': 'cut my hand', 'immediate_actions_taken': 'A coworker helped bandage it up'}, {'property_damage': ""No, there wasn't any other damage. My name is Amir Khaled"", 'reporter_contact_info': '+1-555-0345'}, {'additional_notes': 'I think we could use some sharper knives in the kitchen'}, {'witnesses': 'No, I was alone in the kitchen'}, {'incident_location': 'in our company kitchen'}, {'affected_individuals': 'one', 'incident_date': 'February 15, 2023'}, {'incident_time': '11:30 in the morning', 'incident_type': 'workplace injury'}, {'severity_of_incident': 'moderate'}]","[""Oh no, I'm sorry to hear that. What happened and are you okay? Did you need any first aid?"", 'Glad to hear you got some help. Was there any other damage from the incident? Can you also give me your name and contact details so I have them for the report?', 'Thanks for letting me know. Do you have anything else you want to mention about what happened?', ""Got it, I'll make a note of that. Was anyone else around when it happened?"", 'Can you tell me where exactly this took place?', 'Just need a few more details. How many people were affected by the incident? What was the date it happened?', 'Great, last couple questions - what time did it happen and what type of incident are we reporting?', 'Almost done, just need to know how serious the injury was considered. Was it minor, moderate or severe?']","['Yes, I cut my hand while using a knife. A coworker helped bandage it up.', ""No, there wasn't any other damage. My name is Amir Khaled and my number is +1-555-0345."", 'I think we could use some sharper knives in the kitchen.', 'No, I was alone in the kitchen at the time.', 'It occurred in our company kitchen.', 'Only one person was affected, which was me. It occurred on February 15, 2023.', 'It happened at 11:30 in the morning. This would be a workplace injury report.', 'It was considered a moderate injury.']","{'injuries_sustained': 'cut my hand', 'immediate_actions_taken': 'A coworker helped bandage it up', 'property_damage': ""No, there wasn't any other damage. My name is Amir Khaled"", 'reporter_contact_info': '+1-555-0345', 'additional_notes': 'I think we could use some sharper knives in the kitchen', 'witnesses': 'No, I was alone in the kitchen', 'incident_location': 'in our company kitchen', 'affected_individuals': 'one', 'incident_date': 'February 15, 2023', 'incident_time': '11:30 in the morning', 'incident_type': 'workplace injury', 'severity_of_incident': 'moderate'}"
safety_incident_report,"[0, 1, 0, 1, 0, 1, 0, 1, 0, 1, 0, 1, 0, 1]","['HR Assistant: No problem, let me know what happened. Was there anything else you noticed that could have contributed to the incident? Where did it take place exactly?', 'Employee: The floor mats in the office could use replacing. It happened there.', 'HR Assistant: Got it. Do you remember what date it occurred? Also, was it just you or were others impacted too?  ', 'Employee: It was on February 15th, 2023 and it was just me.', 'HR Assistant: Okay, thanks for letting me know. On a scale of minor to severe, how bad was it? Did anyone witness what happened?', 'Employee: It was moderate and no one else saw it.', 'HR Assistant: I appreciate you sharing this with me. Did you end up hurting yourself at all?  ', 'Employee: Yes, I sprained my ankle.', 'HR Assistant: So sorry to hear that. After the incident, what initial steps did you take to care for yourself?', 'Employee: I gave myself first aid.', 'HR Assistant: Glad to hear you took care of yourself right away. Was any equipment or property damaged as well? What exactly are you reporting - a workplace injury?', ""Employee: No, there was no other damage. Yes, I'm reporting a workplace injury."", 'HR Assistant: Almost done, just need your contact details. Also, do you remember around what time it happened?', 'Employee: My name is Alex Jordan, my email is alexartistry@email.com and it was at 10:30 AM.']","[{'additional_notes': 'The floor mats in the office could use replacing. It happened there', 'incident_location': 'floor mats in the office'}, {'incident_date': 'February 15th, 2023', 'affected_individuals': 'it was just me'}, {'severity_of_incident': 'moderate', 'witnesses': 'no one else saw it'}, {'injuries_sustained': 'sprained my ankle'}, {'immediate_actions_taken': 'I gave myself first aid'}, {'property_damage': 'No, there was no other damage', 'incident_type': 'workplace injury'}, {'reporter_contact_info': 'Alex Jordan', 'incident_time': '10:30 AM'}]","['No problem, let me know what happened. Was there anything else you noticed that could have contributed to the incident? Where did it take place exactly?', 'Got it. Do you remember what date it occurred? Also, was it just you or were others impacted too?', 'Okay, thanks for letting me know. On a scale of minor to severe, how bad was it? Did anyone witness what happened?', 'I appreciate you sharing this with me. Did you end up hurting yourself at all?', 'So sorry to hear that. After the incident, what initial steps did you take to care for yourself?', 'Glad to hear you took care of yourself right away. Was any equipment or property damaged as well? What exactly are you reporting - a workplace injury?', 'Almost done, just need your contact details. Also, do you remember around what time it happened?']","['The floor mats in the office could use replacing. It happened there.', 'It was on February 15th, 2023 and it was just me.', 'It was moderate and no one else saw it.', 'Yes, I sprained my ankle.', 'I gave myself first aid.', ""No, there was no other damage. Yes, I'm reporting a workplace injury."", 'My name is Alex Jordan, my email is alexartistry@email.com and it was at 10:30 AM.']","{'additional_notes': 'The floor mats in the office could use replacing. It happened there', 'incident_location': 'floor mats in the office', 'incident_date': 'February 15th, 2023', 'affected_individuals': 'it was just me', 'severity_of_incident': 'moderate', 'witnesses': 'no one else saw it', 'injuries_sustained': 'sprained my ankle', 'immediate_actions_taken': 'I gave myself first aid', 'property_damage': 'No, there was no other damage', 'incident_type': 'workplace injury', 'reporter_contact_info': 'Alex Jordan', 'incident_time': '10:30 AM'}"
