service,speaker,utterance,state,HR_message,Employee_message,entities
performance_review,"[0, 1, 0, 1, 0, 1, 0, 1, 0, 1, 0, 1, 0, 1]","[""HR Assistant: No problem, I'm happy to help. How well do you feel the employee achieved their set goals this past review period? Please rate their performance on a scale of 1 to 5, with 5 being fully achieved. What is the name of the employee you're reviewing?  "", 'Employee: Sofia Alvarez fully achieved her goals at a level 5.', ""HR Assistant: That's great to hear! What kind of goals would you recommend setting for Sofia during the next review period to help her continue to succeed?"", 'Employee: I would recommend maintaining her current level of performance.  ', ""HR Assistant: Excellent. On a scale of 1 to 5, with 5 being exceeds expectations, how would you rate Sofia's overall job performance this past review period?  "", ""Employee: Sofia's overall performance exceeds expectations at a level 5."", ""HR Assistant: Wonderful. What is Sofia's job role and how has she shown growth in her skills over this past review period?"", ""Employee: Sofia's job role is a lawyer and she has developed strong leadership skills."", ""HR Assistant: Thanks for providing those details. For this performance review, what is the time period being assessed? Also, on a scale of 1 to 5, how would you rate Sofia's contribution and collaboration on team projects during this time?"", 'Employee: The time period for this review is the past year from 2021-01-01 to 2021-12-31. Sofia was very collaborative at a level 5.  ', ""HR Assistant: That's great to hear. Can you describe any leadership qualities Sofia has exhibited? Also, are there any areas you feel she could improve to help further her development?"", 'Employee: Sofia is a strategic thinker and exhibits strong leadership. One area for improvement may be maintaining a better work life balance.', 'HR Assistant: Got it, thanks for the feedback. In your opinion, does Sofia need any additional training at this time to further support her growth?', 'Employee: Currently, no additional training is needed.']","[{'goal_achievement': '5', 'employee_name': 'Sofia Alvarez'}, {'next_review_goals': 'maintaining her current level of performance'}, {'overall_performance_rating': 'level 5'}, {'job_role': 'lawyer', 'skill_development': 'strong leadership skills'}, {'review_period': '2021-01-01 to 2021-12-31', 'team_contribution': '5'}, {'leadership_qualities': 'strong', 'areas_for_improvement': 'maintaining a better work life balance'}, {'additional_training_needed': 'no'}]","[""No problem, I'm happy to help. How well do you feel the employee achieved their set goals this past review period? Please rate their performance on a scale of 1 to 5, with 5 being fully achieved. What is the name of the employee you're reviewing?"", ""That's great to hear! What kind of goals would you recommend setting for Sofia during the next review period to help her continue to succeed?"", ""Excellent. On a scale of 1 to 5, with 5 being exceeds expectations, how would you rate Sofia's overall job performance this past review period?"", ""Wonderful. What is Sofia's job role and how has she shown growth in her skills over this past review period?"", ""Thanks for providing those details. For this performance review, what is the time period being assessed? Also, on a scale of 1 to 5, how would you rate Sofia's contribution and collaboration on team projects during this time?"", ""That's great to hear. Can you describe any leadership qualities Sofia has exhibited? Also, are there any areas you feel she could improve to help further her development?"", 'Got it, thanks for the feedback. In your opinion, does Sofia need any additional training at this time to further support her growth?']","['Sofia Alvarez fully achieved her goals at a level 5.', 'I would recommend maintaining her current level of performance.', ""Sofia's overall performance exceeds expectations at a level 5."", ""Sofia's job role is a lawyer and she has developed strong leadership skills."", 'The time period for this review is the past year from 2021-01-01 to 2021-12-31. Sofia was very collaborative at a level 5.', 'Sofia is a strategic thinker and exhibits strong leadership. One area for improvement may be maintaining a better work life balance.', 'Currently, no additional training is needed.']","{'goal_achievement': '5', 'employee_name': 'Sofia Alvarez', 'next_review_goals': 'maintaining her current level of performance', 'overall_performance_rating': 'level 5', 'job_role': 'lawyer', 'skill_development': 'strong leadership skills', 'review_period': '2021-01-01 to 2021-12-31', 'team_contribution': '5', 'leadership_qualities': 'strong', 'areas_for_improvement': 'maintaining a better work life balance', 'additional_training_needed': 'no'}"
performance_review,"[0, 1, 0, 1, 0, 1, 0, 1, 0, 1, 0, 1]","[""HR Assistant: No problem, let's take a look. What was the overall time period we're looking at here? You can give me the dates like 2021-01-01 to 2022-01-01 if that works."", ""Employee: The time period we're looking at is the past year."", ""HR Assistant: Okay, great. What's Carlos's name and how would you rate his overall performance on a scale of 1 to 5, with 5 being the highest? "", ""Employee: Carlos Mendez's name. His overall performance rating is a 5."", ""HR Assistant: That's excellent. How well do you think Carlos achieved the goals that were set for him? Again on a 1 to 5 scale, with 5 being fully achieved. What kinds of goals should be set for Carlos for the next review period?"", 'Employee: Carlos achieved his set goals at a 4. The goal for the next review period should be for him to lead a project.  ', ""HR Assistant: Wonderful, it's great to hear he's making progress towards his goals. What leadership qualities, if any, did you notice Carlos exhibiting? And how would you rate his contribution to any team projects, on a 1 to 5 scale?"", 'Employee: Carlos mentored junior engineers. He contributed at a 5 to team projects.', ""HR Assistant: Thanks for sharing all that. What was Carlos's job role during this period? Are there any areas you think he could improve on?"", ""Employee: Carlos's job role was an engineer. One area for improvement is his time management."", 'HR Assistant: Got it, thanks for the feedback. Does Carlos need any additional training to further develop his skills? Also, what kinds of learning or growth have you seen from Carlos over this period?', 'Employee: Carlos could benefit from leadership training. He has learned new skills.']","[{'review_period': 'the past year'}, {'employee_name': ""Carlos Mendez's"", 'overall_performance_rating': '5'}, {'goal_achievement': '4', 'next_review_goals': 'for him to lead a project'}, {'leadership_qualities': 'Carlos mentored junior engineers', 'team_contribution': '5'}, {'job_role': 'engineer', 'areas_for_improvement': 'time management'}, {'additional_training_needed': 'leadership', 'skill_development': 'He has learned new skills'}]","[""No problem, let's take a look. What was the overall time period we're looking at here? You can give me the dates like 2021-01-01 to 2022-01-01 if that works."", ""Okay, great. What's Carlos's name and how would you rate his overall performance on a scale of 1 to 5, with 5 being the highest?"", ""That's excellent. How well do you think Carlos achieved the goals that were set for him? Again on a 1 to 5 scale, with 5 being fully achieved. What kinds of goals should be set for Carlos for the next review period?"", ""Wonderful, it's great to hear he's making progress towards his goals. What leadership qualities, if any, did you notice Carlos exhibiting? And how would you rate his contribution to any team projects, on a 1 to 5 scale?"", ""Thanks for sharing all that. What was Carlos's job role during this period? Are there any areas you think he could improve on?"", 'Got it, thanks for the feedback. Does Carlos need any additional training to further develop his skills? Also, what kinds of learning or growth have you seen from Carlos over this period?']","[""The time period we're looking at is the past year."", ""Carlos Mendez's name. His overall performance rating is a 5."", 'Carlos achieved his set goals at a 4. The goal for the next review period should be for him to lead a project.', 'Carlos mentored junior engineers. He contributed at a 5 to team projects.', ""Carlos's job role was an engineer. One area for improvement is his time management."", 'Carlos could benefit from leadership training. He has learned new skills.']","{'review_period': 'the past year', 'employee_name': ""Carlos Mendez's"", 'overall_performance_rating': '5', 'goal_achievement': '4', 'next_review_goals': 'for him to lead a project', 'leadership_qualities': 'Carlos mentored junior engineers', 'team_contribution': '5', 'job_role': 'engineer', 'areas_for_improvement': 'time management', 'additional_training_needed': 'leadership', 'skill_development': 'He has learned new skills'}"
performance_review,"[0, 1, 0, 1, 0, 1, 0, 1, 0, 1, 0, 1, 0, 1, 0, 1]","['HR Assistant: No problem, what time period are we looking at for this review? Maybe something like from when to when did your work get reviewed?', 'Employee: My review period is from January 2023 to December 2023.', 'HR Assistant: Okay, great. Could you tell me a bit about any skills you felt you developed or ways you grew in your learning during that time?  ', 'Employee: I felt I improved my classroom management skills.', ""HR Assistant: Thanks for sharing that. On a scale of 1 to 5, how would you rate Angela's contributions to any team projects during the review period, with 5 being the highest? Also, what is Angela's job role?"", 'Employee: I would rate her contributions as a 5. Angela is a teacher.', 'HR Assistant: Got it, thanks. Are there any areas you think Angela could improve going forward?', 'Employee: One area for improvement is time management.', 'HR Assistant: No problem. In your opinion, does Angela need any additional training to help with that? What goals might you set for her next review period?', 'Employee: Angela does not need additional training. A goal for the next review period could be to improve her time management skills.  ', 'HR Assistant: On a scale of 1 to 5, how well do you feel Angela achieved the goals that were set for her in the last review period, with 5 being fully achieved?', ""Employee: I'd rate her achievement of goals as a 4."", ""HR Assistant: Lastly, on the same 1 to 5 scale, how would you rate Angela's overall performance during the review period?"", 'Employee: I would rate her overall performance as a 4.', ""HR Assistant: Thanks for your time. Before we wrap up, is there anything Angela has demonstrated in terms of leadership qualities during the review period? And can I get Angela's full name for the record?"", 'Employee: Angela has mentored new teachers. Angela Thomas.']","[{'review_period': 'January 2023 to December 2023'}, {'skill_development': 'classroom management skills'}, {'team_contribution': '5', 'job_role': 'teacher'}, {'areas_for_improvement': 'time management'}, {'additional_training_needed': 'not', 'next_review_goals': 'improve her time management skills'}, {'goal_achievement': '4'}, {'overall_performance_rating': '4'}, {'leadership_qualities': 'has mentored new teachers', 'employee_name': 'Angela Thomas'}]","['No problem, what time period are we looking at for this review? Maybe something like from when to when did your work get reviewed?', 'Okay, great. Could you tell me a bit about any skills you felt you developed or ways you grew in your learning during that time?', ""Thanks for sharing that. On a scale of 1 to 5, how would you rate Angela's contributions to any team projects during the review period, with 5 being the highest? Also, what is Angela's job role?"", 'Got it, thanks. Are there any areas you think Angela could improve going forward?', 'No problem. In your opinion, does Angela need any additional training to help with that? What goals might you set for her next review period?', 'On a scale of 1 to 5, how well do you feel Angela achieved the goals that were set for her in the last review period, with 5 being fully achieved?', ""Lastly, on the same 1 to 5 scale, how would you rate Angela's overall performance during the review period?"", ""Thanks for your time. Before we wrap up, is there anything Angela has demonstrated in terms of leadership qualities during the review period? And can I get Angela's full name for the record?""]","['My review period is from January 2023 to December 2023.', 'I felt I improved my classroom management skills.', 'I would rate her contributions as a 5. Angela is a teacher.', 'One area for improvement is time management.', 'Angela does not need additional training. A goal for the next review period could be to improve her time management skills.', ""I'd rate her achievement of goals as a 4."", 'I would rate her overall performance as a 4.', 'Angela has mentored new teachers. Angela Thomas.']","{'review_period': 'January 2023 to December 2023', 'skill_development': 'classroom management skills', 'team_contribution': '5', 'job_role': 'teacher', 'areas_for_improvement': 'time management', 'additional_training_needed': 'not', 'next_review_goals': 'improve her time management skills', 'goal_achievement': '4', 'overall_performance_rating': '4', 'leadership_qualities': 'has mentored new teachers', 'employee_name': 'Angela Thomas'}"
performance_review,"[0, 1, 0, 1, 0, 1, 0, 1, 0, 1, 0, 1, 0, 1]","['HR Assistant: No problem, what kind of goals would you like to set for the next review period?  ', ""Employee: I'd like to publish one or two research papers."", ""HR Assistant: That's great, Henry. Tell me a bit about the new skills you've learned and your role as a scientist here."", ""Employee: As a scientist, I've learned some new data analysis techniques over the past year."", ""HR Assistant: Thanks for sharing. On a scale of 1 to 5, how would you rate Henry's contributions to team projects, with 5 being the highest? And how well do you feel Henry achieved his previous goals?"", ""Employee: Henry receives a 5 for his contributions to team projects. I'd give him a 4 for achieving his previous goals.    "", 'HR Assistant: Okay, got it. Is there any additional training that would help Henry in his role?', 'Employee: Leadership training could help Henry.', ""HR Assistant: Almost done! On a scale of 1 to 5, what would you say is Henry's overall performance rating, and is there any area you think could be improved?  "", ""Employee: Henry's overall performance rating is a 5. One area for improvement may be time management."", ""HR Assistant: Just one more question - what was the time period for this review and what is Henry's name?"", 'Employee: The time period for this review was the past year from 2021-01-01 to 2022-01-01. Henry Kim.', 'HR Assistant: Great, thanks for walking me through this. Lastly, did Henry exhibit any leadership qualities over this past year?', 'Employee: Henry mentored some of the junior scientists.']","[{'next_review_goals': 'publish one or two research papers'}, {'skill_development': 'data analysis techniques', 'job_role': 'scientist'}, {'team_contribution': '5', 'goal_achievement': '4'}, {'additional_training_needed': 'Leadership'}, {'overall_performance_rating': '5', 'areas_for_improvement': 'time management'}, {'employee_name': 'Henry Kim', 'review_period': '2021-01-01 to 2022-01-01'}, {'leadership_qualities': 'Henry mentored some of the junior scientists'}]","['No problem, what kind of goals would you like to set for the next review period?', ""That's great, Henry. Tell me a bit about the new skills you've learned and your role as a scientist here."", ""Thanks for sharing. On a scale of 1 to 5, how would you rate Henry's contributions to team projects, with 5 being the highest? And how well do you feel Henry achieved his previous goals?"", 'Okay, got it. Is there any additional training that would help Henry in his role?', ""Almost done! On a scale of 1 to 5, what would you say is Henry's overall performance rating, and is there any area you think could be improved?"", ""Just one more question - what was the time period for this review and what is Henry's name?"", 'Great, thanks for walking me through this. Lastly, did Henry exhibit any leadership qualities over this past year?']","[""I'd like to publish one or two research papers."", ""As a scientist, I've learned some new data analysis techniques over the past year."", ""Henry receives a 5 for his contributions to team projects. I'd give him a 4 for achieving his previous goals."", 'Leadership training could help Henry.', ""Henry's overall performance rating is a 5. One area for improvement may be time management."", 'The time period for this review was the past year from 2021-01-01 to 2022-01-01. Henry Kim.', 'Henry mentored some of the junior scientists.']","{'next_review_goals': 'publish one or two research papers', 'skill_development': 'data analysis techniques', 'job_role': 'scientist', 'team_contribution': '5', 'goal_achievement': '4', 'additional_training_needed': 'Leadership', 'overall_performance_rating': '5', 'areas_for_improvement': 'time management', 'employee_name': 'Henry Kim', 'review_period': '2021-01-01 to 2022-01-01', 'leadership_qualities': 'Henry mentored some of the junior scientists'}"
performance_review,"[0, 1, 0, 1, 0, 1, 0, 1, 0, 1, 0, 1, 0, 1, 0, 1]","['HR Assistant: No problem, what kind of additional training do you think Sofia may need, if any?', ""Employee: Sofia doesn't require any additional training."", ""HR Assistant: Okay, great. What's Sofia's name?"", ""Employee: Sofia's name is Sofia Alvarez. "", 'HR Assistant: Thanks. What type of role does Sofia have?', ""Employee: Sofia's role is that of a lawyer."", 'HR Assistant: Wonderful. Could you tell me about any skill development or learning growth that Sofia has shown?', 'Employee: Sofia has developed strong leadership skills.', ""HR Assistant: That's fantastic. On a scale of 1 to 5, how would you rate Sofia's contributions to team projects, with 1 being the lowest and 5 being the highest? What areas, if any, do you think Sofia could improve in?  "", 'Employee: Sofia led major cases and received a 5. She needs to work on maintaining a good work-life balance.', ""HR Assistant: No problem. What time period does this review cover? And what would you say is Sofia's overall performance rating on a scale of 1 to 5?"", ""Employee: This review covers the past year. Sofia's overall performance rating is a 5."", ""HR Assistant: That's great to hear. On a scale of 1 to 5, how well do you think Sofia achieved her set goals, with 1 being the lowest and 5 being the highest? What goals should Sofia focus on for the next review period?"", 'Employee: Sofia fully achieved her goals, which is a 5. Her goals for the next period should be to maintain her strong performance.', 'HR Assistant: Thanks for sharing. Could you tell me about any leadership qualities Sofia has exhibited?', 'Employee: Sofia shows strategic thinking and is good at motivating others.']","[{'additional_training_needed': ""doesn't require any additional training""}, {'employee_name': 'Sofia Alvarez'}, {'job_role': 'lawyer'}, {'skill_development': 'strong leadership skills'}, {'team_contribution': '5', 'areas_for_improvement': 'maintaining a good work-life balance'}, {'review_period': 'the past year', 'overall_performance_rating': '5'}, {'goal_achievement': 'fully', 'next_review_goals': 'to maintain her strong performance'}, {'leadership_qualities': 'shows strategic thinking and is good at motivating others'}]","['No problem, what kind of additional training do you think Sofia may need, if any?', ""Okay, great. What's Sofia's name?"", 'Thanks. What type of role does Sofia have?', 'Wonderful. Could you tell me about any skill development or learning growth that Sofia has shown?', ""That's fantastic. On a scale of 1 to 5, how would you rate Sofia's contributions to team projects, with 1 being the lowest and 5 being the highest? What areas, if any, do you think Sofia could improve in?"", ""No problem. What time period does this review cover? And what would you say is Sofia's overall performance rating on a scale of 1 to 5?"", ""That's great to hear. On a scale of 1 to 5, how well do you think Sofia achieved her set goals, with 1 being the lowest and 5 being the highest? What goals should Sofia focus on for the next review period?"", 'Thanks for sharing. Could you tell me about any leadership qualities Sofia has exhibited?']","[""Sofia doesn't require any additional training."", ""Sofia's name is Sofia Alvarez."", ""Sofia's role is that of a lawyer."", 'Sofia has developed strong leadership skills.', 'Sofia led major cases and received a 5. She needs to work on maintaining a good work-life balance.', ""This review covers the past year. Sofia's overall performance rating is a 5."", 'Sofia fully achieved her goals, which is a 5. Her goals for the next period should be to maintain her strong performance.', 'Sofia shows strategic thinking and is good at motivating others.']","{'additional_training_needed': ""doesn't require any additional training"", 'employee_name': 'Sofia Alvarez', 'job_role': 'lawyer', 'skill_development': 'strong leadership skills', 'team_contribution': '5', 'areas_for_improvement': 'maintaining a good work-life balance', 'review_period': 'the past year', 'overall_performance_rating': '5', 'goal_achievement': 'fully', 'next_review_goals': 'to maintain her strong performance', 'leadership_qualities': 'shows strategic thinking and is good at motivating others'}"
