service,speaker,utterance,state,HR_message,Employee_message,entities
performance_review,"[0, 1, 0, 1, 0, 1, 0, 1, 0, 1, 0, 1, 0, 1]","['HR Assistant: No problem, what time period are we looking at here? If you could provide the start and end dates in YYYY-MM-DD format that would be great.', ""Employee: The time period we're reviewing is the past year."", 'HR Assistant: Okay, great. On a scale of 1 to 5, with 5 being the highest, how would you rate your overall performance during that time?', 'Employee: I would rate my overall performance as a 4.  ', 'HR Assistant: Thanks for providing that rating. Are there any areas you think you could improve on? Also, could you tell me your name so I have it on the review?', 'Employee: Two areas I think I could improve on are time management. My name is Amir Khaled.', 'HR Assistant: No problem, thanks for that information. On the same 1 to 5 scale, how well do you feel you achieved the goals that were set for you? And is there any additional training you feel would be beneficial?', 'Employee: I achieved my set goals at a level of 4. Additional training in pastry skills would be helpful.', ""HR Assistant: Great, it's good to set goals and work towards achieving them. Could you describe any leadership qualities you've shown? And what is your job role?"", 'Employee: I mentor junior chefs. My role is chef.  ', 'HR Assistant: Excellent, mentoring others is great experience. What types of goals should we set for your next review period?', 'Employee: Learning new cuisines should be a goal for the next review period.', ""HR Assistant: Sounds like a very useful goal. Last question - on the 1 to 5 scale, how would you rate your contribution to team projects? And can you describe any skills or learning you've gained?"", 'Employee: I would rate my contribution to team projects as a 5. I have improved my cooking skills.']","[{'review_period': 'the past year'}, {'overall_performance_rating': '4'}, {'areas_for_improvement': 'time management', 'employee_name': 'Amir Khaled'}, {'goal_achievement': '4', 'additional_training_needed': 'pastry skills'}, {'leadership_qualities': 'I mentor junior chefs', 'job_role': 'chef'}, {'next_review_goals': 'Learning new cuisines'}, {'team_contribution': '5', 'skill_development': 'I have improved my cooking skills'}]","['No problem, what time period are we looking at here? If you could provide the start and end dates in YYYY-MM-DD format that would be great.', 'Okay, great. On a scale of 1 to 5, with 5 being the highest, how would you rate your overall performance during that time?', 'Thanks for providing that rating. Are there any areas you think you could improve on? Also, could you tell me your name so I have it on the review?', 'No problem, thanks for that information. On the same 1 to 5 scale, how well do you feel you achieved the goals that were set for you? And is there any additional training you feel would be beneficial?', ""Great, it's good to set goals and work towards achieving them. Could you describe any leadership qualities you've shown? And what is your job role?"", 'Excellent, mentoring others is great experience. What types of goals should we set for your next review period?', ""Sounds like a very useful goal. Last question - on the 1 to 5 scale, how would you rate your contribution to team projects? And can you describe any skills or learning you've gained?""]","[""The time period we're reviewing is the past year."", 'I would rate my overall performance as a 4.', 'Two areas I think I could improve on are time management. My name is Amir Khaled.', 'I achieved my set goals at a level of 4. Additional training in pastry skills would be helpful.', 'I mentor junior chefs. My role is chef.', 'Learning new cuisines should be a goal for the next review period.', 'I would rate my contribution to team projects as a 5. I have improved my cooking skills.']","{'review_period': 'the past year', 'overall_performance_rating': '4', 'areas_for_improvement': 'time management', 'employee_name': 'Amir Khaled', 'goal_achievement': '4', 'additional_training_needed': 'pastry skills', 'leadership_qualities': 'I mentor junior chefs', 'job_role': 'chef', 'next_review_goals': 'Learning new cuisines', 'team_contribution': '5', 'skill_development': 'I have improved my cooking skills'}"
performance_review,"[0, 1, 0, 1, 0, 1, 0, 1, 0, 1, 0, 1]","['HR Assistant: No problem, let me see what I can do. What additional training, if any, do you think would benefit you moving forward? Overall, how would you say your performance has been on a scale of 1 to 5, with 5 being the highest?  ', ""Employee: At this time, I don't feel any additional training is needed. I'd rate my performance overall as a 4."", ""HR Assistant: Great, can you provide me with your name so I can fill that part out? I'd also love to hear about any ways you've helped guide your fellow coworkers."", ""Employee: My name is Priya Singh. I've helped mentor some of the junior developers."", 'HR Assistant: Wonderful, thanks Priya. How well do you think you achieved the goals that were set for you at your last review? And how would you rate your contributions to team projects, again on a 1 to 5 scale?', 'Employee: I achieved my goals at a level 4. I would rate my contributions to team projects as a 5.  ', 'HR Assistant: Almost done! Last two questions - what was the time period covered by this review? Also, are there any areas you think you could still improve in?', 'Employee: The time period for this review was January 2023 to December 2023. One area I could still improve is my time management skills.', 'HR Assistant: Just one more question - what is your role here?', 'Employee: I am a Software Developer.', ""HR Assistant: Great, last thing - tell me about any new skills you've picked up or ways you've grown in your learning. What goals would you like to focus on for your next review period?"", ""Employee: I've learned some new programming languages over the past year. My goal for the next review period would be to complete my certification by December 2023.""]","[{'additional_training_needed': 'any additional training is needed', 'overall_performance_rating': '4'}, {'employee_name': 'Priya Singh', 'leadership_qualities': ""I've helped mentor some of the junior developers""}, {'goal_achievement': '4', 'team_contribution': '5'}, {'review_period': 'January 2023 to December 2023', 'areas_for_improvement': 'time management skills'}, {'job_role': 'Software Developer'}, {'skill_development': ""I've learned some new programming languages"", 'next_review_goals': 'to complete my certification by December 2023'}]","['No problem, let me see what I can do. What additional training, if any, do you think would benefit you moving forward? Overall, how would you say your performance has been on a scale of 1 to 5, with 5 being the highest?', ""Great, can you provide me with your name so I can fill that part out? I'd also love to hear about any ways you've helped guide your fellow coworkers."", 'Wonderful, thanks Priya. How well do you think you achieved the goals that were set for you at your last review? And how would you rate your contributions to team projects, again on a 1 to 5 scale?', 'Almost done! Last two questions - what was the time period covered by this review? Also, are there any areas you think you could still improve in?', 'Just one more question - what is your role here?', ""Great, last thing - tell me about any new skills you've picked up or ways you've grown in your learning. What goals would you like to focus on for your next review period?""]","[""At this time, I don't feel any additional training is needed. I'd rate my performance overall as a 4."", ""My name is Priya Singh. I've helped mentor some of the junior developers."", 'I achieved my goals at a level 4. I would rate my contributions to team projects as a 5.', 'The time period for this review was January 2023 to December 2023. One area I could still improve is my time management skills.', 'I am a Software Developer.', ""I've learned some new programming languages over the past year. My goal for the next review period would be to complete my certification by December 2023.""]","{'additional_training_needed': 'any additional training is needed', 'overall_performance_rating': '4', 'employee_name': 'Priya Singh', 'leadership_qualities': ""I've helped mentor some of the junior developers"", 'goal_achievement': '4', 'team_contribution': '5', 'review_period': 'January 2023 to December 2023', 'areas_for_improvement': 'time management skills', 'job_role': 'Software Developer', 'skill_development': ""I've learned some new programming languages"", 'next_review_goals': 'to complete my certification by December 2023'}"
performance_review,"[0, 1, 0, 1, 0, 1, 0, 1, 0, 1, 0, 1]","[""HR Assistant: No problem, what goals did you have in mind for the next review period? Also, if you could let me know how you've grown your skills over this past year that would be great."", 'Employee: I was thinking of publishing two papers and further developing my research skills.', 'HR Assistant: Thanks for sharing that with me. On a scale of 1 to 5, how would you say your overall performance has been? Do you feel you need any additional training to help you succeed?  ', ""Employee: I'd say my performance has exceeded expectations. Some grants and publications training could be useful."", 'HR Assistant: Absolutely. Could I get your name please? And how well do you feel you achieved the goals you set previously?', 'Employee: My name is Henry Kim. I think I achieved most of my goals.', 'HR Assistant: Wonderful to hear Henry. Do you exhibit any leadership qualities that you think are worth mentioning? And how well would you say you contribute to team projects?', ""Employee: I try to mentor some of the junior scientists. I also feel I'm very collaborative. "", 'HR Assistant: Got it, and what is your current role?', ""Employee: I'm a Scientist."", 'HR Assistant: Thanks for your time Henry. Lastly, are there any areas you think need improvement? Also, what is the time period for this review?', 'Employee: Time management is something I can work on. This review covers the past year.']","[{'next_review_goals': 'publishing two papers and further developing my research skills', 'skill_development': 'research skills'}, {'overall_performance_rating': 'exceeded expectations', 'additional_training_needed': 'grants and publications'}, {'employee_name': 'Henry Kim', 'goal_achievement': 'most'}, {'leadership_qualities': 'I try to mentor some of the junior scientists', 'team_contribution': 'very collaborative'}, {'job_role': 'Scientist'}, {'areas_for_improvement': 'Time management', 'review_period': 'the past year'}]","[""No problem, what goals did you have in mind for the next review period? Also, if you could let me know how you've grown your skills over this past year that would be great."", 'Thanks for sharing that with me. On a scale of 1 to 5, how would you say your overall performance has been? Do you feel you need any additional training to help you succeed?', 'Absolutely. Could I get your name please? And how well do you feel you achieved the goals you set previously?', 'Wonderful to hear Henry. Do you exhibit any leadership qualities that you think are worth mentioning? And how well would you say you contribute to team projects?', 'Got it, and what is your current role?', 'Thanks for your time Henry. Lastly, are there any areas you think need improvement? Also, what is the time period for this review?']","['I was thinking of publishing two papers and further developing my research skills.', ""I'd say my performance has exceeded expectations. Some grants and publications training could be useful."", 'My name is Henry Kim. I think I achieved most of my goals.', ""I try to mentor some of the junior scientists. I also feel I'm very collaborative."", ""I'm a Scientist."", 'Time management is something I can work on. This review covers the past year.']","{'next_review_goals': 'publishing two papers and further developing my research skills', 'skill_development': 'research skills', 'overall_performance_rating': 'exceeded expectations', 'additional_training_needed': 'grants and publications', 'employee_name': 'Henry Kim', 'goal_achievement': 'most', 'leadership_qualities': 'I try to mentor some of the junior scientists', 'team_contribution': 'very collaborative', 'job_role': 'Scientist', 'areas_for_improvement': 'Time management', 'review_period': 'the past year'}"
performance_review,"[0, 1, 0, 1, 0, 1, 0, 1, 0, 1, 0, 1, 0, 1]","[""HR Assistant: No problem, let's take a look. What period of time does this review cover? You can give me the dates in YYYY-MM-DD format if it's easier. What additional training, if any, would benefit the employee going forward?  "", 'Employee: The review period is from January 2023 to December 2023. Some cloud architecture training would be useful.', ""HR Assistant: Great, I'd like to get a sense of how the employee has grown professionally over the past year. What new skills or knowledge have they developed?"", 'Employee: I learned new frameworks.', 'HR Assistant: Wonderful. Can you provide the name of the employee being reviewed and describe any leadership they may have shown?', ""Employee: The employee's name is Priya Singh. She guided junior developers.  "", 'HR Assistant: Thanks for sharing. To help the employee improve, what areas do you think they could focus on developing more?', 'Employee: Time management skills could be improved.', ""HR Assistant: Appreciate the feedback. On a scale of 1 to 5, with 5 being the highest, how would you rate the employee's overall performance?"", ""Employee: Priya's overall performance rating is a 4."", ""HR Assistant: That's great to hear. On the same 1 to 5 scale, how well did the employee achieve their set goals for the review period? What new goals could be established to help them continue growing?"", 'Employee: She achieved her goals at a 4. A new goal could be to complete cloud architecture certification.', ""HR Assistant: One last thing - what is the employee's role and how would you rate their contribution to team projects on a 1 to 5 scale?"", 'Employee: Priya is a Software Developer. Her contribution to team projects is a 5.']","[{'review_period': 'January 2023 to December 2023', 'additional_training_needed': 'cloud architecture'}, {'skill_development': 'I learned new frameworks'}, {'employee_name': 'Priya Singh', 'leadership_qualities': 'She guided junior developers'}, {'areas_for_improvement': 'Time management skills'}, {'overall_performance_rating': '4'}, {'goal_achievement': '4', 'next_review_goals': 'to complete cloud architecture certification'}, {'job_role': 'Software Developer', 'team_contribution': '5'}]","[""No problem, let's take a look. What period of time does this review cover? You can give me the dates in YYYY-MM-DD format if it's easier. What additional training, if any, would benefit the employee going forward?"", ""Great, I'd like to get a sense of how the employee has grown professionally over the past year. What new skills or knowledge have they developed?"", 'Wonderful. Can you provide the name of the employee being reviewed and describe any leadership they may have shown?', 'Thanks for sharing. To help the employee improve, what areas do you think they could focus on developing more?', ""Appreciate the feedback. On a scale of 1 to 5, with 5 being the highest, how would you rate the employee's overall performance?"", ""That's great to hear. On the same 1 to 5 scale, how well did the employee achieve their set goals for the review period? What new goals could be established to help them continue growing?"", ""One last thing - what is the employee's role and how would you rate their contribution to team projects on a 1 to 5 scale?""]","['The review period is from January 2023 to December 2023. Some cloud architecture training would be useful.', 'I learned new frameworks.', ""The employee's name is Priya Singh. She guided junior developers."", 'Time management skills could be improved.', ""Priya's overall performance rating is a 4."", 'She achieved her goals at a 4. A new goal could be to complete cloud architecture certification.', 'Priya is a Software Developer. Her contribution to team projects is a 5.']","{'review_period': 'January 2023 to December 2023', 'additional_training_needed': 'cloud architecture', 'skill_development': 'I learned new frameworks', 'employee_name': 'Priya Singh', 'leadership_qualities': 'She guided junior developers', 'areas_for_improvement': 'Time management skills', 'overall_performance_rating': '4', 'goal_achievement': '4', 'next_review_goals': 'to complete cloud architecture certification', 'job_role': 'Software Developer', 'team_contribution': '5'}"
performance_review,"[0, 1, 0, 1, 0, 1, 0, 1, 0, 1, 0, 1, 0, 1]","['HR Assistant: No problem, what kind of leadership have you seen from this employee? Also, is there any extra training they could benefit from?  ', 'Employee: He mentors the junior scientists and could use some leadership training.', 'HR Assistant: Great, on a scale of 1 to 5 how well do you feel they contribute to team projects?', 'Employee: He is very collaborative, always willing to help others complete projects.', ""HR Assistant: That's wonderful. Could you tell me about any new skills they have picked up?"", 'Employee: He has learned a few new techniques that have expanded his abilities.  ', 'HR Assistant: Alright, what is the name of the employee and how would you rate their overall performance?', ""Employee: The employee's name is Henry Kim and he exceeds expectations in his work."", 'HR Assistant: Thanks for the info. Are there any areas you think they could improve in? Also, what is their job role?', 'Employee: He sometimes struggles with time management but is a scientist.', 'HR Assistant: Got it. On a scale of 1 to 5 how well do you think they achieved their set goals? What goals should be set for next time?', 'Employee: He fully achieved his goals of publishing research papers and should continue that work.', 'HR Assistant: Almost done, just need the time period for this review.', 'Employee: This review covers the past year, from 2020-01-01 to 2021-01-01.']","[{'leadership_qualities': 'He mentors the junior scientists', 'additional_training_needed': 'leadership'}, {'team_contribution': 'very collaborative'}, {'skill_development': 'He has learned a few new techniques that have expanded his abilities'}, {'employee_name': 'Henry Kim', 'overall_performance_rating': 'he exceeds expectations'}, {'areas_for_improvement': 'time management', 'job_role': 'scientist'}, {'goal_achievement': 'fully', 'next_review_goals': 'publishing research papers'}, {'review_period': '2020-01-01 to 2021-01-01'}]","['No problem, what kind of leadership have you seen from this employee? Also, is there any extra training they could benefit from?', 'Great, on a scale of 1 to 5 how well do you feel they contribute to team projects?', ""That's wonderful. Could you tell me about any new skills they have picked up?"", 'Alright, what is the name of the employee and how would you rate their overall performance?', 'Thanks for the info. Are there any areas you think they could improve in? Also, what is their job role?', 'Got it. On a scale of 1 to 5 how well do you think they achieved their set goals? What goals should be set for next time?', 'Almost done, just need the time period for this review.']","['He mentors the junior scientists and could use some leadership training.', 'He is very collaborative, always willing to help others complete projects.', 'He has learned a few new techniques that have expanded his abilities.', ""The employee's name is Henry Kim and he exceeds expectations in his work."", 'He sometimes struggles with time management but is a scientist.', 'He fully achieved his goals of publishing research papers and should continue that work.', 'This review covers the past year, from 2020-01-01 to 2021-01-01.']","{'leadership_qualities': 'He mentors the junior scientists', 'additional_training_needed': 'leadership', 'team_contribution': 'very collaborative', 'skill_development': 'He has learned a few new techniques that have expanded his abilities', 'employee_name': 'Henry Kim', 'overall_performance_rating': 'he exceeds expectations', 'areas_for_improvement': 'time management', 'job_role': 'scientist', 'goal_achievement': 'fully', 'next_review_goals': 'publishing research papers', 'review_period': '2020-01-01 to 2021-01-01'}"
performance_review,"[0, 1, 0, 1, 0, 1, 0, 1, 0, 1, 0, 1]","['HR Assistant: No problem, what was your job role over the past year? What goals do you think would be good to focus on for the coming year? ', ""Employee: Over the past year I've been working as a musician. For the coming year, I'd like to focus on releasing my first album and doing a tour to promote it."", 'HR Assistant: That sounds exciting! Could you tell me a bit about how your guitar skills have developed over the past year?', 'Employee: My guitar skills have improved significantly over the past year.', 'HR Assistant: Great to hear! On a scale of 1 to 5, with 5 being the highest, how would you rate your contributions to any band projects? And how well do you feel you achieved the goals you set last year?', 'Employee: I would rate my contributions to band projects as a 5. I would rate how well I achieved my goals from last year as a 4.  ', 'HR Assistant: Thanks for sharing. On the same 1 to 5 scale, what overall rating would you give your performance over the past year? And what was the time period for this review?', 'Employee: I would give my overall performance from January 2023 to December 2023 a rating of 4.', ""HR Assistant: Okay, what are some areas you think you could improve on going forward? And what's your name?"", 'Employee: Two areas I could improve are time management and leadership skills. My name is Elijah Barnes.', ""HR Assistant: That's great feedback, Elijah. Is there any additional training that could help with that? Also, did you demonstrate any strong leadership qualities over the past year?"", ""Employee: Taking some music production classes could help improve my skills. Over the past year I showed that I'm creative, passionate and help motivate those around me.""]","[{'job_role': 'musician', 'next_review_goals': 'releasing my first album and doing a tour to promote it'}, {'skill_development': 'improved significantly'}, {'team_contribution': '5', 'goal_achievement': '4'}, {'overall_performance_rating': '4', 'review_period': 'January 2023 to December 2023'}, {'areas_for_improvement': 'time management and leadership skills', 'employee_name': 'Elijah Barnes'}, {'additional_training_needed': 'music production', 'leadership_qualities': 'help motivate those around me'}]","['No problem, what was your job role over the past year? What goals do you think would be good to focus on for the coming year?', 'That sounds exciting! Could you tell me a bit about how your guitar skills have developed over the past year?', 'Great to hear! On a scale of 1 to 5, with 5 being the highest, how would you rate your contributions to any band projects? And how well do you feel you achieved the goals you set last year?', 'Thanks for sharing. On the same 1 to 5 scale, what overall rating would you give your performance over the past year? And what was the time period for this review?', ""Okay, what are some areas you think you could improve on going forward? And what's your name?"", ""That's great feedback, Elijah. Is there any additional training that could help with that? Also, did you demonstrate any strong leadership qualities over the past year?""]","[""Over the past year I've been working as a musician. For the coming year, I'd like to focus on releasing my first album and doing a tour to promote it."", 'My guitar skills have improved significantly over the past year.', 'I would rate my contributions to band projects as a 5. I would rate how well I achieved my goals from last year as a 4.', 'I would give my overall performance from January 2023 to December 2023 a rating of 4.', 'Two areas I could improve are time management and leadership skills. My name is Elijah Barnes.', ""Taking some music production classes could help improve my skills. Over the past year I showed that I'm creative, passionate and help motivate those around me.""]","{'job_role': 'musician', 'next_review_goals': 'releasing my first album and doing a tour to promote it', 'skill_development': 'improved significantly', 'team_contribution': '5', 'goal_achievement': '4', 'overall_performance_rating': '4', 'review_period': 'January 2023 to December 2023', 'areas_for_improvement': 'time management and leadership skills', 'employee_name': 'Elijah Barnes', 'additional_training_needed': 'music production', 'leadership_qualities': 'help motivate those around me'}"
